seen_date,state,city,shape,summary,duration,posted_date
2015-07-04T21:15:00,AZ,Tempe,light,Two red orbs hovering over the firework display appered around 9:15 pm and lasted 25-35 min. Multiple people saw the object and couldnt,30 minutes,2015-07-06T00:00:00
2015-07-04T21:15:00,FL,Ocala,circle,I captured video of an orange orbs during 4th of July celebration.  The fireworks we're set off to the W.,1:30 seconds,2015-07-06T00:00:00
2015-07-04T21:15:00,NC,Greensboro,light,I watched a UFO viewing 4th of July fireworks.,15 minutes,2015-07-06T00:00:00
2015-07-04T21:20:00,FL,Hollywood,fireball,We saw 4 double orange fireballs flying in the sky!,5-7 seconds,2015-07-06T00:00:00
2015-07-04T21:20:00,FL,Vero Beach,circle,"HUGE ORANGE BRIGHT BALL HOVERING, THEN CHANGING POSITION.",10 minutes,2015-07-06T00:00:00
,MO,Oran,,"Would like information about reported UFO crash in 1941 between Oran and Morley, Missouri.",,
1997-10-15T20:45:00,TX,Stephenville,circle,"Central Texas Sighting in Fall of 1997. Pulsing, single craft at EXTREME SPEEDS.",10 minutes,2001-01-03T00:00:00
2015-06-26T14:30:00,FL,Melbourne,circle,"Observed a black round or saucer shaped object traveling from south to north, then making a 90 degree turn west.",4 minutes,2015-07-03T00:00:00
2015-06-26T17:00:00,CA,Catalina Island,other,"Unidentified Flying Object above Catalina Island, June 2015.",~4 minutes,2015-07-03T00:00:00
2015-06-26T21:00:00,NY,Albany,unknown,"3 orange moving lights in the sky, not aircraft.",~5 minutes,2015-07-03T00:00:00
2015-06-26T22:00:00,NY,Angola,light,Red orb speed about mock 9 pulcated then dissapared over tree line.,5-6 minutes,2015-07-03T00:00:00
2015-06-26T22:15:00,CA,Fairfield,circle,Two pulsating lights over the hills of  Fairfield,20 minutes,2015-07-03T00:00:00
2015-06-26T22:15:00,CA,Discovery Bay,diamond,"Diamond shaped aircraft, it was flying low and had a really strange humming/buzzing/vibrating sound. Two very bright-white large lights",2 minutes,2015-07-03T00:00:00
2015-06-26T23:15:00,NJ,Palmyra,formation,"Seen on Highland Ave.(CR 602) In Palmyra, NJ heading eastward in a triangular formation.",5 seconds,2015-07-03T00:00:00
2015-06-26T23:50:00,,Provinciales (Turks & Caicos),sphere,Glowing red sphere seen over Caribbean Sea.,5 minutes,2015-07-03T00:00:00
2015-06-26T23:15:00,MA,Leicester,circle,"Craft seen zooming through the air at the blink of an eye, looked like a backwards shooting star.",5 seconds,2015-07-03T00:00:00
2015-06-27T01:00:00,GA,Albany,other,Orange light seen from distance.  Got closer and saw it was strange craft covered in lights.  Did not make any sound.,3 minutes,2015-07-03T00:00:00
1998-05-15T20:00:00,IN,Vincennes,triangle,Triangular object hovered in evenig sky,5 minutes,2001-01-03T00:00:00
2015-06-27T13:20:00,WA,Vancouver,other,Took awhile for me to grab my camera as I was thinking â€œNo Wayâ€.,15-30 minutes,2015-07-03T00:00:00
2015-06-27T20:17:00,NE,Lexington,disk,"Bright orange lit saucer going over Lexington, NE, north to south.",5-10 minutes,2015-07-03T00:00:00
2015-06-27T20:30:00,CA,Rialto,fireball,Thought it was an airplane on fire until it stopped in midair for 20-30 sec b4 flickering out.,2 minutes,2015-07-03T00:00:00
2015-07-16T01:00:00,OH,Eton,disk,((HOAX??))  it was wight,,2015-07-17T00:00:00
2015-07-16T01:45:00,CA,Encinitas,circle,Three dancing lights.,30 minutes,2015-07-17T00:00:00
2015-07-16T17:00:00,NC,Indian Trail,cigar,5 cigar shaped craft at high altitude.,2 minutes,2015-07-17T00:00:00
2015-07-16T19:23:00,KY,Central City,cigar,Silver cigar shaped craft flying very high and very fast through the entire length of our visual horizon.,2-3 minutes,2015-07-17T00:00:00
2015-07-16T20:35:00,CA,Escondido,light,Bright circular light turns into a cross shape while moving towards my Patio/Building,2 minutes,2015-07-17T00:00:00
2015-07-16T21:00:00,FL,Cutler Bay,light,Strange aircraft.,1:20,2015-07-17T00:00:00
2015-07-16T21:10:00,CA,Palmdale,triangle,Saw a triangle looking object with lights on all corners and another object following it moving fast to the east.,2 minutes,2015-07-17T00:00:00
2017-04-29T21:30:00,CA,Sacramento,circle,"Driving on 99 south through Sacramento around 9:30 pm, seen 2 orange round objects dancing/flying together.  Other cars slowed down.",30 seconds,2017-05-06T00:00:00
1998-06-01T19:00:00,,Bundaverg (Australia),circle,i just went outside before i went 2 bed and saw it mooving around high above in the air,5 secs,2001-01-03T00:00:00
2015-07-16T22:00:00,TN,Nashville,other,UFOs at the Cumberland River Edge.,5 hours,2015-07-17T00:00:00
2015-07-16T22:00:00,AR,Greenbrier,circle,Two strange lights over Greenbrier.,~10 minutes,2015-07-17T00:00:00
2015-07-16T22:00:00,AL,Fairhope,fireball,Fireball moving across the sky for a good 2 minutes.,1-2 minutes,2015-07-17T00:00:00
2015-07-16T22:10:00,MD,Hagerstown,sphere,"Glowing orange sphere seen by 2 of us headed from north to south in Hagerstown, MD",2 minutes,2015-07-17T00:00:00
2015-07-16T23:15:00,NY,Cicero,oval,"An orange, glowing, oval shaped object seen in the night sky, which soon disappeared into the distance.",30 seconds,2015-07-17T00:00:00
2015-07-04T21:20:00,IL,Crystal Lake,light,Red light.,25 minutes,2015-07-06T00:00:00
2015-07-04T21:20:00,FL,Panama City Beach,light,Square cluster of lights over beachfront,15+ minutes,2015-07-06T00:00:00
2015-07-04T21:22:00,PA,Sharon,fireball,Four red/orange fireballs seen over sharon/farrell pa materializing and disapearing,1 hour,2015-07-06T00:00:00
2015-07-04T21:25:00,CO,Highlands Ranch,triangle,Blue/red/green triangular object above fireworks display.,15 minutes,2015-07-06T00:00:00
2015-07-04T21:25:00,CA,San Mateo,light,Fast moving light on 4th of July.,45 seconds,2015-07-06T00:00:00
1998-06-20T14:00:00,OK,Claremore,sphere,Nothing on this earth moves that fast!,15sec.,2001-01-03T00:00:00
2015-07-04T21:29:00,AZ,Tempe,sphere,"Craft under intelligent control, flying in Tempe, AZ.",30 minutes,2015-07-06T00:00:00
2015-07-04T21:30:00,NY,Syracuse,fireball,Orange Orbs... at least 30 spotted over 2 plus hours during fireworks display.,2 hours +,2015-07-06T00:00:00
2015-07-04T21:30:00,OR,Seaside,light,Orange lights on coast.,5 minutes,2015-07-06T00:00:00
2015-07-04T21:30:00,PA,Duncannon,fireball,"Unknown object seen over Duncannon, Pa  on July 4th",1 minute,2015-07-06T00:00:00
2015-07-04T21:30:00,SC,Lake Wylie,unknown,Red-orange object hovering during firework display in South Carolina.,15,2015-07-06T00:00:00
2015-07-04T21:30:00,NY,Dix Hills,light,Noticed a bright red ball to the east which was heading in a westerly direction.  It's altitude appeared very high.  The lights appeare,10,2015-07-06T00:00:00
2015-07-04T21:30:00,NE,Auburn,unknown,"White or yellowish solid lighted objects, seven in a row seen traveling across the night sky.",15 minutes,2015-07-06T00:00:00
1972-04-14T15:00:00,WA,Seattle,disk,"Sighting: Distance was 1500-2000 feet in altitude, and was around 60 degrees off the horizon. Weather conditions were clear with some l",4 minutes,2015-06-15T00:00:00
1995-02-18T12:30:00,NC,Charlotte,sphere,Reflective solid object hung motionless in the sky before shooting off at an extremely high rate of speed.,1.5 to 2 minutes,2015-06-15T00:00:00
1995-11-23T19:00:00,CO,Loveland,triangle,Triangle ship following a ball of light.,30 minutes,2015-06-15T00:00:00
1975-03-06T02:00:00,,"Melbourne (VIC, Australia)",diamond,"The object my cousin and i saw was hexaganal in shape,orange in colour,hovering low and  at a slow velocity. It appeared to be about a ",30 minutes,2000-12-20T00:00:00
2005-07-20T23:00:00,SC,Lexington,light,Strange light in the sky seen while camping,30 minutes,2015-06-15T00:00:00
2010-05-01T23:00:00,GA,Calhoun,triangle,"Triangular lights, perfectly equilateral, moving in strange directions and slowly spreading out as if descending.",20 minutes roughly,2015-06-15T00:00:00
2013-08-15T00:00:00,IL,Cordova,other,"Multi-colored translucent parachute-shaped UFO flashes briefly in the sky falling to ground, indiscernible size. Jellyfish-looking obje",,2015-06-15T00:00:00
2013-09-15T22:30:00,,Ballynahinch ((Northern Ireland),,"No noise, just superfast, and far in universe.",20 seconds,2015-06-15T00:00:00
2014-09-02T02:00:00,HI,Kapaa,unknown,"Kauai 3, UFO sighted.  Donkey Beach, Kapaa, HI.",4 hours,2015-06-15T00:00:00
2015-02-15T23:00:00,NV,North Las Vegas,diamond,((HOAX??))  A diamond brownish dark mass came over my head and down towards the ground.,4 seconds,2015-06-15T00:00:00
2015-03-15T23:30:00,MI,Marquette,light,Photographed mysterious light over Lake Superior.,30 minutes,2015-06-15T00:00:00
2015-04-10T00:00:00,NV,South Lake Tahoe,light,7 luminous objects.,90 seconds,2015-06-15T00:00:00
2015-06-27T21:00:00,OR,Seaside,circle,Looked like 2 red fireballs 1 fell the other hovered before the lite went off but through binoculars could still see a dark for desend,1 minute,2015-07-03T00:00:00
2015-04-10T18:00:00,NV,Lake Tahoe,unknown,ufo on the day time,90 seconds,2015-06-15T00:00:00
1974-06-10T14:30:00,TX,Merkel,disk,"Very high daylight disc moving south to north, with no deviation of course or altitude or speed.",5 minutes,2000-12-20T00:00:00
2015-06-27T21:30:00,PA,Northern Allegheny County,flash,Red flashes of light traveling NNW followed by an unlit helicopter at night.,1 hour,2015-07-03T00:00:00
2015-06-27T21:45:00,MO,Saint Peters,formation,Colored lights assembled into diamond shape then gave off a very bright light,3 minutes,2015-07-03T00:00:00
2015-06-27T22:07:00,CA,Long Beach,circle,"Equilateral triangle of diffuse, stationary white lights off coast.",3 minutes,2015-07-03T00:00:00
2015-06-27T23:15:00,CA,Newbury Park,light,3 bright white lights in the sky.,6 minutes,2015-07-03T00:00:00
2015-06-28T00:22:00,WI,Milwaukee,fireball,"I live in a 14th floor apartment in downtown Milwaukee. As I was getting ready for bed this past Sat night / Sun morning, I looked out",3-4 minutes,2015-07-03T00:00:00
2015-06-28T01:30:00,NC,Charlotte,unknown,Four evenly spaced lights.,3 minutes,2015-07-03T00:00:00
2015-06-28T19:20:00,NY,Floral Park,other,Drone-ish type thing.,10 minutes,2015-07-03T00:00:00
2015-06-28T21:00:00,VT,Colchester,oval,Noticed a bright red light over the tree line.  towards Burlington Vt.  I never have seen a plane this bright so I went to look.,5,2015-07-03T00:00:00
2015-06-28T21:30:00,NY,Poughkeepsie,triangle,Triangular flying object with white lights on each angle and green light in the middle. Traveled at un-normal flying speeds.,30 seconds,2015-07-03T00:00:00
2015-06-28T22:00:00,IA,Cedar Rapids,light,2 bright lights with flashing lights on sides. Hovering in western sky.  ((NUFORC Note:  Venus and Jupiter.  PD)),15-20 minutes,2015-07-03T00:00:00
1975-06-01T23:59:00,TN,Nashville,light,sudden burst of brilliant yellow light,seconds,2000-12-20T00:00:00
2015-06-28T22:00:00,TX,Dallas,light,I was in the car driving home when my friend asked me what some lights in the night sky are.  It was in the general area of Love field,1.5 hours,2015-07-03T00:00:00
2015-06-28T23:30:00,MT,Sidney,light,"2 stationary orange balls of light over Sidney, MT, in the night sky.",1 minute,2015-07-03T00:00:00
2015-07-17T04:00:00,NV,Henderson,sphere,"I saw an orb-like object in the sky, with green and blue iridescent like trails.",4-5 seconds,2015-07-17T00:00:00
2015-07-04T21:30:00,NJ,Scotch Plains,circle,2 green circular lights. One higher than the other and the one below was on the right at an angle not directly below the one above it.,1 hour,2015-07-06T00:00:00
2015-07-04T21:35:00,PA,Hanover Township,changing,Multiple objects traveling in paths and hovering while emitting intermittent sparks and/or flames.,6-7 minutes,2015-07-06T00:00:00
2015-07-04T21:40:00,FL,Port Charlotte,fireball,2 bright red and orange fireball shaped objects slowly flying above the tree line in my back yard around 9:40pm  The craft hov,4 minutes,2015-07-06T00:00:00
2015-07-04T21:35:00,FL,Palm Bay,light,"There were two slow flashing lights, red in color. They were north of my location, strobing in sync with each other.",90 seconds,2015-07-06T00:00:00
2015-07-04T21:45:00,PA,Bethlehem,triangle,Triangular formation of cream-white lights seen in Bethlehem Pa 4th of July 2015.,2 minutes,2015-07-06T00:00:00
2015-07-04T21:45:00,NC,Colfax,sphere,Small circular glowing orange orb flying just above the tree line passes perpendicular above vehicle on I-40 in Guilford County.,15 seconds,2015-07-06T00:00:00
2015-07-04T21:45:00,OR,Ashland,light,Fireworks and sighting.,1 minute,2015-07-06T00:00:00
1975-12-21T19:00:00,MA,North Attleboro,sphere,"Outline of the craft clearly seen, rotating lights, no noise, slowly moving south",15 minutes,2000-12-20T00:00:00
2015-07-04T21:45:00,NY,Levittown,fireball,Moving lights red/orange; no sound; not fixed or rotoary wing aircraft.,10 minutes,2015-07-06T00:00:00
2015-07-04T21:45:00,IL,Ottawa,light,"Five balls of light falling from Ottawa, IL, sky.",1 minute,2015-07-06T00:00:00
2015-07-04T21:45:00,NM,Albuquerque,disk,Bright white disk in clouds moving northward over albuquerque.,20 seconds,2015-07-06T00:00:00
2015-07-04T21:45:00,NJ,Brick,other,"5 consecutively spaced (1 per 45 sec.) yellow flame-like colored light, soundless objects slowly passing NE to SW.",5-8 minutes,2015-07-06T00:00:00
2015-07-04T21:50:00,MO,Pacific,oval,"I saw an orange-red oval light travel from east to west in a jig-jag flight pattern, moving very quickly.",30 seconds,2015-07-06T00:00:00
2015-05-12T23:00:00,MN,Oakdale,triangle,Then a triangle shape came out of the clouds with white lights on all 3 corners one red in middle.,10 seconds,2015-06-15T00:00:00
2015-05-16T16:30:00,NY,Hartsdale,other,"Large transparent object in Hartsdale, NY.",5 Seconds,2015-06-15T00:00:00
2015-05-18T00:00:00,MN,Saint Paul,triangle,"TR3B craft (Blk w/ white lights underneath, triangle), hovering low & slow, I lost it but it may have shapeshifted into an airplane.",5-10 minutes,2015-06-15T00:00:00
2015-05-24T23:30:00,MN,Savage,triangle,2 triangular objects with ability to change direction without banking; also able to disappear suddenly.,5 minutes,2015-06-15T00:00:00
2015-05-26T22:50:00,WI,Waukesha,unknown,"I was driving south on west avenue toward college avenue, thought it was an airplane above the trees  moving in for a landing at the lo",30 seconds,2015-06-15T00:00:00
1976-06-01T12:00:00,CT,Meridien,other,I was walking home from a friends house in chamberlin heights to my house on springdale ave I heard a humming sound I looked up and saw,15 minutes,2000-12-20T00:00:00
2015-05-27T00:30:00,NY,North Tonnawanda,sphere,"Strange red object over Grand Island, NY.",15 minutes,2015-06-15T00:00:00
2015-05-29T19:00:00,NY,Minoa,cigar,Cigar or oval shaped craft with red lights on one end and green lights on the other with no wings.,5 minutes,2015-06-15T00:00:00
2015-05-30T22:30:00,CO,Aurora,fireball,"Six orange crafts flew over our house late Friday night, one at a time.",12 minutes,2015-06-15T00:00:00
2015-06-02T00:00:00,FL,Naples,circle,"Naples, Florida, ufo sighting!",10 minutes,2015-06-15T00:00:00
2015-06-03T20:40:00,MS,Richland,other,"I, along with 6 witnesses saw Fleets of UFOs disappearing into portal I have 4 1/2 min of video.",8 minutes,2015-06-15T00:00:00
2015-06-04T21:15:00,CA,Santa Rosa,light,"Huge bright light on top of Taylor Mountain ridge. Looked like huge spot light, perfect circle. Watched it for total of 5 mins and film",5 minutes,2015-06-15T00:00:00
2015-06-04T22:45:00,CA,Anaheim,oval,My wife and I saw what by all appearances was a UFO at Disneyland on the night of June 4th 2015.,5-6 minutes,2015-06-15T00:00:00
2015-06-28T23:44:00,VA,Alexandria,fireball,"Orange flickering ball. Looked like junk burning in the sky, as if something was reentering. It wasn't moving fast, appeared that it wa",1 minute,2015-07-03T00:00:00
2015-06-29T00:00:00,PA,Walnutport,unknown,Seen something jet black crawling around the bushes on all fours about 2 foot by 2 foot.,1 minute,2015-07-03T00:00:00
2015-06-29T00:15:00,MI,Paw Paw,light,Two Brite red lights.,10,2015-07-03T00:00:00
1979-08-25T12:36:00,MI,Cass City,disk,It happened out in the middle of nowhere and it lasted only five minutes.,5minutes,2000-12-20T00:00:00
2015-06-29T00:30:00,AL,Huntsville,other,"Object burning as it flew in a trajectory parallel to the ground, with flaming pieces.  ((NUFORC Note:  Satellite re-entry.  PD))",1 minute,2015-07-03T00:00:00
2015-06-29T00:30:00,AZ,Phoenix,egg,"A large flagellated bug, the size of a house, silently floating around Phoenix.",6 seconds,2015-07-03T00:00:00
2015-06-29T01:00:00,GA,Senoia,fireball,Fireball with 2 long tails traveling high above tree tops traveling SW to NE; visible for approximately 10-15 seconds. ((Satellite)),10-15 seconds,2015-07-03T00:00:00
2015-06-29T01:00:00,LA,Patterson,rectangle,Saw a rectangle obj. with fire on each end and smoking moving from SE to NW...appeared to about the size of a bed on a pickup truck.,2-3 minutes,2015-07-03T00:00:00
2015-06-29T01:15:00,SC,Chester,fireball,"Fireball With Long Tail Witnessed by 3 Observers  in Chester, SC, at 1AM on June 29, 2015.  ((NUFORC Note:  Satellite re-entry.  PD))",20-30 seconds,2015-07-03T00:00:00
2015-06-29T01:30:00,GA,Gainesville,fireball,"Multiple objects possibly on fire, leaving a bright trail.  ((NUFORC Note:  Re-entering satellite.  PD))",1 minute,2015-07-03T00:00:00
2015-06-29T01:51:00,SC,Rock Hill,other,Space Debris falls out of orbit and burns up.  ((NUFORC Note:  Confirmed satellite re-entry.  PD)),30 seconds,2015-07-03T00:00:00
2015-06-29T04:30:00,MD,Herald Harbor,other,"Extremely loud, hovered suspende in night sky for four minutes, three white lights, one red light, one bright horizontal beam of light.",30 minutes,2015-07-03T00:00:00
2015-06-29T08:00:00,TX,Austin,other,"Large, wispy clouds passing over greenbelt area that hum/buzz continuously as a bee swarm would sould.  There is a low frequency tone t",continuous x3 days,2015-07-03T00:00:00
2015-07-04T21:52:00,OH,Brunswick,sphere,Spherical Objects over Cleveland area.,1 hour,2015-07-06T00:00:00
1982-06-01T16:00:00,,Quepos (Costa Rica),disk,we wher driving on a small street ther wher no lights then we all look to are left and seen this brite red lights it lit the forest up,1hr,2000-12-20T00:00:00
2015-07-04T21:54:00,IL,Justice,circle,"6 orange/red balls sighted in Justice, IL.",20 seconds/4 minutes,2015-07-06T00:00:00
2015-07-04T21:55:00,MO,Columbia,light,"It was at this time we saw a large, fire engine red object, a little smaller than a dime at armâ€™s length just above the tops of the tre",10 minutes,2015-07-06T00:00:00
2015-07-04T22:00:00,OH,West Chester,fireball,Multiple orange balls of light traveling from west to east in West Chester OH sky.,10 minutes,2015-07-06T00:00:00
2015-07-04T22:00:00,UT,Provo,light,"White light appeared, and disappeared.",10-12 minutes,2015-07-06T00:00:00
2015-07-04T22:00:00,WA,Vancouver,unknown,"Red and green lights flashing, while hovering and moving, then stopping.",30 minutes,2015-07-06T00:00:00
2015-07-04T22:00:00,ON,Wasaga Beach,light,Red light spotted in sky in Wasaga Beach moving all over the place in one spot while ascending.,3 minutes,2015-07-06T00:00:00
2015-07-04T22:00:00,WI,Tomahawk,teardrop,"On July 4, 2015, after observing the fireworks display in Tomahawk, WI, we observed 6 teardrop shaped objects moving through the sky.",30 minutes,2015-07-06T00:00:00
2015-07-04T22:00:00,IL,Chicago,fireball,Possible ufo encounter.,5 minutes,2015-07-06T00:00:00
2015-07-04T22:00:00,GA,Acworth,circle,Was not a plane or fireworks!  We could clearly see the shape of it!,15 minutes,2015-07-06T00:00:00
2015-07-04T22:00:00,OH,Sandusky,formation,Lights had a triangle shape but  then changed... One to 5 lights making a formation then flipping turning or elevation... Crazy stuff,5-10 minutes,2015-07-06T00:00:00
1986-08-15T21:00:00,AB,Banff National Park,diamond,LARGE Black Diamond shaped craft with three rotating lights on extended arms,10 seconds,2000-12-20T00:00:00
2015-07-04T22:00:00,VA,Leesburg,light,A single red light travels across the night sky before disappearing.,2 minutes,2015-07-06T00:00:00
2015-07-04T22:00:00,VA,Leesburg,light,The light appeared to move horizontally across the sky at a steady pace before stopping and suddenly shooting up vertically.,30-60 seconds,2015-07-06T00:00:00
2015-06-04T23:45:00,WA,Sumner,light,LOW BRIGHT WHITE LIGHT CHANGES TO ORANGE.,10-15 minutes,2015-06-15T00:00:00
2015-06-05T03:00:00,MI,Mount Pleasant,light,((HOAX??))  I was taken to an alien laboratory from my bedroom.,Unknown - a few hours?,2015-06-15T00:00:00
2015-06-05T05:15:00,OR,Gresham,changing,We saw an object above the hot tub.,15 minutes,2015-06-15T00:00:00
2015-06-05T05:19:00,OR,Gresham,changing,((HOAX??))((Deleted profanity))  I have photo and short video!,10 minutes,2015-06-15T00:00:00
2015-06-05T05:20:00,OR,Gresham,changing,My friend came in here and told us to hurry up and come outside and when we went outside I saw a thing at first.,15 minutes,2015-06-15T00:00:00
2015-06-05T09:20:00,IL,Chicago,light,"It was a light, and just changing colors.",spring,2015-06-15T00:00:00
2015-06-05T10:25:00,IL,Chicago,oval,It was kind of a light but more like circle.,Spring,2015-06-15T00:00:00
2015-06-05T11:10:00,WI,Madison,changing,from my office overlooking downtown and state street.  this dark object traveled from north to south above the buildings but below the,4 minutes,2015-06-15T00:00:00
2017-04-29T22:00:00,MN,Eden Prairie,formation,"Glowing cloud ring Eden Prairie, MN.  ((NUFORC Note:  Ring of stationary advertising lights at local casino.  PD))",Ongoing,2017-05-06T00:00:00
1989-08-15T01:20:00,,Tilburg (Netherlands),triangle,I saw a triangular shaped object rotating slowly in the sky..Had four lights in it...,20 Seconds,2000-12-20T00:00:00
2015-06-05T15:30:00,IN,Elkhart,cigar,In the back yard of a buddies house throwing horse shoes (by myself while waiting for my friend to finish cutting 2 other friends hair),15 seconds,2015-06-15T00:00:00
2015-06-05T16:00:00,CA,Cobb,circle,Round dot in full daylight.  Hovered for hours not moving but progressed towards west at same rate as sun setting west.  Since then sky,3 hours,2015-06-15T00:00:00
2015-06-05T20:00:00,FL,Sarasota,cone,Saw 10 to15 red ufo with red pulsating lights and a bright in the middle.  They moved across the sky and disappeared.,30 minutes,2015-06-15T00:00:00
2015-06-05T20:30:00,,Folsom,sphere,Was driving down towards highway 50 right after a lightning storm and noticed these two objects orbiting each other near a break in the,1 minute,2015-06-15T00:00:00
2015-06-29T12:30:00,NC,Chapel Hill,cylinder,Disc or cylindrical craft moving at very high speed,5 seconds,2015-07-03T00:00:00
2015-06-29T14:00:00,KY,Mount Sterling,teardrop,Me and my wife were outside at 2:00pm and saw 2 ships. Lager ship was about 2 miles long,20-25 seconds,2015-07-03T00:00:00
2015-06-29T14:30:00,CA,Shell Beach,circle,Object in clear daylight sky.,on going,2015-07-03T00:00:00
2015-06-29T16:00:00,CT,Bethel,oval,Silver round object hoovering in the sky during daytime.,5 minutes,2015-07-03T00:00:00
2015-06-29T19:00:00,OH,Youngstown,light,"Two circular light hovering one another with a flashing light above.   Top light flashing blue, green, red and white.",10 minutes,2015-07-03T00:00:00
2015-06-29T20:20:00,,Haifa (Israel),formation,"Diagonal formation of 3 objects, round shaped, flickering lights",1 second,2015-07-03T00:00:00
1989-09-06T16:58:00,CA,Palm Springs,disk,AND i thought it was a typical vaction,drive bye,2000-12-20T00:00:00
2015-06-29T20:30:00,SC,McCormick,triangle,"Silent, black triangular shaped craft ascending from water and slowly passing over treeline.",30 seconds,2015-07-03T00:00:00
2015-06-29T21:30:00,CA,San Pedro,unknown,((NUFORC Note:  Planets.  PD)) I'm looking off the balcony looking W and I see 2 lights one bright and one right above it but smaller.,12 minutes,2015-07-03T00:00:00
2015-06-29T21:30:00,MA,Everett,sphere,"Two bright white lights,just above horizon.Lights were stationary,at approximately 45 degree angle.After 15 minutes lights drifted sout",30 minutes,2015-07-03T00:00:00
2015-06-29T21:45:00,KY,Madisonville,cross,Two orange stationary lights in the sky fade then reappear.  ((NUFORC Note:  Venus and Jupiter??  PD)),30 minutes,2015-07-03T00:00:00
2015-06-29T22:00:00,NE,Omaha,other,((HOAX??))  Omaha aliens?,5 minutes,2015-07-03T00:00:00
2015-06-29T22:00:00,NJ,Pompton Lakes,light,2 circular lights over the W sky in the dir. of the Wannaque  Res.. The two lights would vanish.((NUFORC Note:  Venus and Jupiter.  PD),8 minutes,2015-07-03T00:00:00
2015-06-29T22:00:00,WA,Lakewood,circle,"Two very bright orbs stationary on horizon west of Lakewood, WA.  ((NUFORC Note:  Venus and Jupiter.  PD))",40 minutes ongoing,2015-07-03T00:00:00
2015-07-04T22:00:00,WI,Minocqua,,About 10 pm while sitting around campfire watching local lake fireworks with many others  this fairly slow moving object cam over us. I,5 minutes,2015-07-06T00:00:00
2015-07-04T22:00:00,PA,Uniontown,fireball,"3 fireball like objects in the sky.  Recorded and it shows its multicolored purple, green etc.  Lasts about 2 to 3 minutes.",2-3 minutes per occura,2015-07-06T00:00:00
2015-07-04T22:00:00,NY,Webster,fireball,Bright red/orange fireball spotted in southeast sky,1 minute,2015-07-06T00:00:00
1994-06-12T15:40:00,,Crawley (UK/England),triangle,"It appeared over me and sat there. Once i looked at it, it blinked out like a light.",7mins,2000-12-20T00:00:00
2015-07-04T22:00:00,CO,Westminster,circle,Had the strangest experience last night watching fireworks.   We parked at this lookout on 82nd and Federal which gave us a full Panora,2 minutes,2015-07-06T00:00:00
2015-07-04T22:00:00,VA,Chesapeake,light,Star like light over Chesapeake suddenly accelerates across the night sky,~70 minutes,2015-07-06T00:00:00
