seen_date,state,city,shape,summary,duration,posted_date
2015-07-19T15:30:00,,Fife (UK/Scotland),oval,"Whilst at the local Knockhill Racing Circuit (Fife, Scotland) we noted a set of strange lights in the distance that appeared to be stat",6 minutes,2015-07-23T00:00:00
2015-07-19T19:00:00,MO,Lee's Summit,light,"Changing from dim red and blue to bright white, then vanishing.",5 minutes,2015-07-23T00:00:00
2000-09-16T00:45:00,NY,Selden,circle,hello 1) 5 lights 2) circle then converge in middle almost touching then go back and recircle i saw it for about 30 min. my sistersaw i,an hour,2000-09-17T00:00:00
2015-07-19T22:12:00,CA,Santa Barbara,circle,"Yellowish orange, odd circular object observed over Santa Barbara Ca.",2+ minutes,2015-07-23T00:00:00
2015-07-19T22:30:00,NM,Santa Fe,other,I saw a bright light it was green circle shape falling from the sky very bright and 15 minutes after that there was a UFO kind a look l,,2015-07-23T00:00:00
2015-07-19T22:30:00,NY,Wilson,triangle,3 orange/red color ball shape objects in triangle formation traveling west.,5 minutes,2015-07-23T00:00:00
2015-07-19T22:30:00,NE,La Junta,cylinder,Watching lightning storm southeast of La Junta a green-blue object appeared and shot north across the sky at a very fast speed then dis,5-10 seconds,2015-07-23T00:00:00
2015-07-19T23:30:00,WA,Olympia,cigar,"Long dark silent cigar shaped object in Olympia, WA, with lights on both ends",3 minutes,2015-07-23T00:00:00
2015-07-20T00:00:00,,Lubbock,,Looking north in Lubbock sky and saw green light fall from sky...,3 seconds,2015-07-23T00:00:00
2015-07-20T00:00:00,NC,Hendersonville,triangle,It was 3 lights that stud still for 10 minutes. then went right.,15 minutes,2015-07-23T00:00:00
2015-07-20T00:45:00,NC,Hendersonville,triangle,Triangular UFO sighting.,10 minutes,2015-07-23T00:00:00
2015-07-20T01:55:00,AB,Two Hills,light,"Me my sister and her two friends were having a campfire I am age 20 they are are 14-15, I was supervising them when I seen the first li",30 minutes,2015-07-23T00:00:00
2015-07-20T02:00:00,CA,Rocklin,triangle,Star-like Object wobbling in the Distance and a Large Black Triangular object with 3 bright lights and a red light in the middle.,5 minutes,2015-07-23T00:00:00
2017-04-29T20:53:00,NV,Las Vegas,formation,Triangular formation of 3 diamond-shaped craft with center craft moving erratically in multiple directions.,5 seconds,2017-05-06T00:00:00
1972-10-01T23:00:00,WA,Monroe,rectangle,STOP AND GO THE SIZE OF A LARG CAR WITH NO WINDOWS,15 MIN,2001-01-03T00:00:00
2015-07-09T20:00:00,NC,Oak Island,other,"Brightly lit, multi-light object flying in erratic pattern near seashore at Oak Island, NC",5 minutes,2015-07-17T00:00:00
2015-07-09T22:00:00,TX,Haltom City,circle,Lights over Haltom City.,2 minutes,2015-07-17T00:00:00
2015-07-09T21:00:00,OR,Saint Helens,diamond,"Seen object above SW side of St. Helens, OR. Guessing was under 1000 ft.  Strange movement jogs and jags.",45 minutes,2015-07-17T00:00:00
2015-07-10T00:45:00,IL,Springfield,unknown,"A light appeared out of no where at night during a drive-in movie.  Went straight a little then curved dramatically, ~90 degrees.",Short,2015-07-17T00:00:00
2015-07-10T12:25:00,OH,Delaware,disk,My girlfriend and I had a late Friday dinner in downtown Delaware. We left the restaurant at 8:15 to go back to her residence and start,10 minutes,2015-07-17T00:00:00
2015-07-10T18:02:00,VA,Waterford,light,Two bright lights moving mostly south.,1 minute,2015-07-17T00:00:00
2015-07-10T21:00:00,NY,Mastic Beach,circle,"Reddish orange ball shaped object.  At first, I thought is was a firework, but the object began to rise.",4 minutes,2015-07-17T00:00:00
2015-07-10T21:00:00,NY,Mastic Beach,circle,"Approx. 9 pm I spotted a reddish orange ball shaped object.  At first i thought is was a firework, but the obj. began to rise.",4 minutes,2015-07-17T00:00:00
2015-07-10T21:15:00,CA,Playa Vista,flash,Swirling bolt of light or lightning.,2-3 seconds,2015-07-17T00:00:00
2015-07-10T21:30:00,MA,Chilmark,light,3  lights in trangular formation which faded out.,3 minutes,2015-07-17T00:00:00
1975-05-01T17:00:00,NV,Reno,disk,A disk shape hovering over my apartment building in broad daylight in a busy city.,2 minutes,2001-01-03T00:00:00
2015-07-10T22:00:00,GA,Marietta,fireball,((NUFORC Note:  No information provided by witness.  PD)),5 seconds,2015-07-17T00:00:00
2015-07-10T22:00:00,NH,Hampton,unknown,Two timing red lights in the sky.,20,2015-07-17T00:00:00
2015-07-10T22:00:00,GA,Marietta,fireball,"The object looked like a small Sun, but not as bright.  It did not have a trail but did have a wide tail the same width as the front.",5 seconds,2015-07-17T00:00:00
2015-07-20T03:20:00,WA,Everett,fireball,While standing at my window with the window open I saw 1-2 orange-ish/ Fire colored lights in the sky over the Everett area near Boeing,1 minutes,2015-07-23T00:00:00
2015-07-20T09:15:00,AB,Edmonton,circle,"Daylight sighting of multiple objects over Edmonton, AB-recorded on two devices by family at park.",25,2015-07-23T00:00:00
2015-07-20T12:34:00,NC,Durham,rectangle,"Silver almost translucent, object flying over Durham.",2 minutes,2015-07-23T00:00:00
2015-07-20T20:38:00,AZ,Sierra Vista,light,Large ball of light seen traveling across the sky and under cloudline,2.5 seconds,2015-07-23T00:00:00
2015-07-20T20:55:00,OK,Bethany,rectangle,My father was in backyard closing up shed as I was in the living room watching tv he comes in and tell me to come outside and look at t,1 minutes,2015-07-23T00:00:00
2015-07-20T22:00:00,SC,Summerville,triangle,Huge Craft in South Carolina Sky (Summerville),15 minutes,2015-07-23T00:00:00
2015-07-20T21:00:00,NY,Monroe,disk,"Disk with two dim red lights, surrounded by a blue aura, with a light whirring sound, almost inaudible. ~300ft in the air",40 minutes,2015-07-23T00:00:00
2000-09-16T15:30:00,NY,New York,formation,Unidetified cluster of objects moving over Manahattan,10minutes,2000-09-17T00:00:00
2015-07-20T22:00:00,NV,North Las Vegas,sphere,"I heard a loud noise that sounded like an airplane flying over. I looked outside and saw 2 orbs flying right next to eachother, practic",1-2 minutes,2015-07-23T00:00:00
2015-07-20T22:00:00,AZ,Aguila,,"((HOAX??))  Craft in high space:  After throwing Booster, it speed up and, disappeared.",10 seconds,2015-07-23T00:00:00
2015-07-20T22:15:00,AL,Huntsville,chevron,"Dark, quiet, large, slow moving, low flying object (about 2,000 ft. from the ground) seen N. bound into Huntsville, AL",2 minutes,2015-07-23T00:00:00
2015-07-21T00:17:00,NJ,Freehold,triangle,Triangular aircraft with white lights and a blinking red light at triangles core,20 seconds,2015-07-23T00:00:00
2015-07-21T01:27:00,UT,Midvale,other,5-6 blue transparent lights membrane or wing coneccting them all moved very quickly from ground up outside kitchen window,2-3 seconds,2015-07-23T00:00:00
2015-07-10T22:15:00,OH,Fairborn,sphere,Orange ball of light flying across the sky.,5 minutes,2015-07-17T00:00:00
2015-07-10T22:45:00,NY,East Amherst,triangle,Black triangle with six lights.,20 seconds,2015-07-17T00:00:00
2015-07-10T23:10:00,NC,New Bern,circle,Bright light in the sky.,5 seconds,2015-07-17T00:00:00
2015-07-10T23:35:00,FL,Venice,circle,"2 orange lights following each other, the one in front slowed down to let the other catch up, then disappeared.",3 minutes,2015-07-17T00:00:00
2015-07-11T00:00:00,VA,Hampton,fireball,"I saw what appeared to be a bright round firey object,appear and disappear so fast you would have thought there was another dimension!",2 seconds,2015-07-17T00:00:00
1976-03-24T21:00:00,TX,Houston,disk,"MY SISTER AND MYSELF WERE WALKING TO A FAMILY STORE ABOUT 3 BLOCKS FROM MY HOUSE, WENT WE WERE HALF WAY THERE A SAUSER SHAPE OBJECT APP",5 MINS.,2001-01-03T00:00:00
2015-07-11T01:00:00,FL,Spring Hill,sphere,"Two red glowing spheres. One was stationary in the middle, while the other made a complete circle around it.",3 minutes,2015-07-17T00:00:00
2015-07-11T03:30:00,HI,Oahu,light,Five to six bright lights seen west coast off Oahu.,,2015-07-17T00:00:00
2015-07-11T05:00:00,CA,Lancaster,circle,"Round, solid white, high altitude object moving S to NE over Antelope Valley, CA.  Non specific side to side motion.",15 minutes,2015-07-17T00:00:00
2015-07-11T05:45:00,FL,Davenport,light,"Bright cobalt blue light on a north-east path from Davenport, FL. @ 5:45 AM.",5 minutes,2015-07-17T00:00:00
2015-07-11T09:45:00,FL,Edgewater,sphere,"Orange orb moving N to S off the east coast of Edgewater, FL; normal movement until a sudden burst northly like a shooting star.",5,2015-07-17T00:00:00
2015-07-11T10:00:00,CO,Fort Collins,sphere,White orb zig-zags into cloud to the west of Fort Collins during bright morning.,2 seconds,2015-07-17T00:00:00
2015-07-11T10:40:00,CA,Lake Arrowhead,unknown,"10:40 am over San Bernardino Valley, very bright light for an instant, then again seen further E and moving W, then vanished.",Seconds,2015-07-17T00:00:00
2015-07-21T21:55:00,WI,Milwaukee,light,Saw bright light complete circle around aircraft and then vanish.,30 seconds,2015-07-23T00:00:00
2015-07-21T22:00:00,FL,Holiday,fireball,"Giant fireball over canal in holiday, Florida",1:30 seconds,2015-07-23T00:00:00
2015-07-21T22:00:00,DE,Wilmington,triangle,"Triangular lights seen over Wilmington, DE, heading towards New Castle along 13",30 seconds,2015-07-23T00:00:00
1976-04-15T01:30:00,CA,Riverside,teardrop,Have  not talked about this for years until now after seeing how the goverment keeps saying ufos are`nt real  then why keep quiet.,8 to 10 minutes,2001-01-03T00:00:00
2015-07-21T22:00:00,WA,Tumwater,fireball,About six consecutive brought orange lights moving slowly across sky following each other.,10-20 minutes,2015-07-23T00:00:00
2015-07-21T22:20:00,MI,Detroit,fireball,Single red orange ball over Detroit.,3-5 minutes,2015-07-23T00:00:00
2015-07-21T22:20:00,KS,Mulberry Township,triangle,"Low flying, extremely slow moving triangular craft sighted in rural Kansas.",5-10 minutes,2015-07-23T00:00:00
2015-07-21T22:23:00,VA,Newport News,triangle,Triangular shaped craft with lights on each point hovering in Newport News near Chestnut Avenue and Aberdeen Roadthen shot up and disap,20 minutes,2015-07-23T00:00:00
2015-07-21T22:30:00,WI,Alden Township,light,Three lights that made a triangle.,10-15 seconds,2015-07-23T00:00:00
2015-07-21T23:35:00,FL,Tampa,sphere,"At approximately 11:30 pm, I saw 5 orange/red sphere (or firebalks) slowly moving from north to south accross the eastern sky",3 minutes,2015-07-23T00:00:00
2015-07-22T00:04:00,KY,Louisville,triangle,Me and girlfriend were out on the deck and this large triangle shaped craft flew right over the top of us flying below the clouds.,~1 minute,2015-07-23T00:00:00
2015-07-21T23:57:00,MI,South Haven,light,Strange light and meteor over lake michigan!,20 seconds,2015-07-23T00:00:00
2015-07-11T11:45:00,,Grays (Essex)(UK/England),circle,"Strange orb with lights in the sky.  ((NUFORC Note:  Probably a lens flare, we suspect.  PD))",,2015-07-17T00:00:00
2015-07-11T12:11:00,CA,Sebastopol,light,8 lights in a straight line with 2 flashing red lights hovering over my neighbors house and it slowly moved away and teleported away.,98 minutes,2015-07-17T00:00:00
1978-06-15T01:30:00,MI,Michigan,unknown,in1978 i was riding on back of motorcycle a couple were in front of us. Over a large grouping of trees i a rural area to our left above,northern,2001-01-03T00:00:00
2015-07-11T18:30:00,FL,Orlando,sphere,"Sphere over Orlando, FL  07.11.15.",~15 seconds,2015-07-17T00:00:00
2015-07-11T20:45:00,AZ,Mesa,triangle,"3 fiery colored lights in line that did not flicker, but eventually dimmed, grew bright, then dimmed and zoomed off quickly one-by-one.",10 minutes,2015-07-17T00:00:00
2015-07-11T21:00:00,NY,Farmingville,sphere,Orange ball of light moving fast and low; no sound at all.,2 minutes,2015-07-17T00:00:00
2015-07-11T21:00:00,MA,Waquoit,light,"Unknown lights near Washburn Island, Cape Cod MA",10 minutes,2015-07-17T00:00:00
2015-07-11T21:00:00,VA,Staunton,light,2 orange lights n sky hovered in same spot beside each other moved just a little then disappeared. Then few minutes later 2 more appear,15 minutes,2015-07-17T00:00:00
2015-07-11T21:10:00,NB,Fredericton,light,"Shimmering, preternaturally flying disc seen in front of clouds in Fredericton, N.B..",30 seconds,2015-07-17T00:00:00
2015-07-11T21:15:00,AL,Montgomery,fireball,Fireball in the sky.,9:25,2015-07-17T00:00:00
2015-07-11T21:30:00,PA,Allison Park,fireball,2 speeding fireballs across the sky slowing up as they were overhead then disappeared.,1 minute (each),2015-07-17T00:00:00
2015-07-11T21:45:00,NJ,Northfield,circle,"Two red lights hovering over home in Northfield, NJ",5 minutes,2015-07-17T00:00:00
2015-07-11T21:45:00,WI,Milwaukee,sphere,"Observed 13 different orange/red spheres moving quietly in small groups, east to west, in a dark night sky.",15-20 minutes,2015-07-17T00:00:00
1980-06-01T23:30:00,,France (massif maures southern),light,"vertically ascending bright light going on and off,that at 2 miles high remains on and shoots up int the stars very very very fast",5mins,2001-01-03T00:00:00
2015-07-22T20:15:00,IL,Chicago,light,Bright orange ufo in sky midway area!,5 minutes,2015-07-23T00:00:00
2015-07-22T21:00:00,KS,Kansas City,diamond,I noticed a violet or pale pink over white object hovering in the south sky just under the moon it was diamond shape on top flat bottom,2-3 minutes,2015-07-23T00:00:00
2015-07-22T20:15:00,AZ,Queen Creek,light,3 Bright orange lights in sky.,15 minutes,2015-07-23T00:00:00
2015-07-22T21:00:00,NY,New Paltz,light,"Silent, pulsating, and maneuvering red light in early evening sky.",5 minutes,2015-07-23T00:00:00
2015-07-22T21:05:00,GA,Gainesville,fireball,An orange glowing fireball passed overhead just after dark,90 seconds,2015-07-23T00:00:00
2015-07-22T21:30:00,PA,Southampton,circle,"5 round objects, hovering, flashing lights.",15 minutes,2015-07-23T00:00:00
2015-07-22T22:00:00,LA,Lake Charles,triangle,"While traveling on I-10, we saw three lights, two white and one red, hovering about the highway.",3 minutes,2015-07-23T00:00:00
2015-07-22T22:00:00,NY,Amherst,light,Hovering orange lights.,5 minutes,2015-07-23T00:00:00
2015-07-22T22:00:00,ME,Topsham,circle,"Quick moving, non-blinking light moving across the night sky above Topsham, Maine.",5 minutes,2015-07-23T00:00:00
2015-07-22T23:00:00,FL,Panama City,fireball,"Looking over the Gulf of Mexico, my wife and I witnessed 3 fireball lights hover, blink then appeared miles away from point of origin i",4-5 seconds,2015-07-23T00:00:00
1980-10-01T23:00:00,LA,Homer,disk,bright light becoming near and more intense in rear veiw window of car,?,2001-01-03T00:00:00
2015-07-22T23:00:00,FL,Indialantic,circle,Circular craft at beach.,3 minutes,2015-07-23T00:00:00
2015-07-22T23:45:00,NY,Monroe,disk,"Disk with rounded top and tower-like structure on top, smaller red lights and larger greenish spot light, hovers in place for 30+ mins.",~15 minutes,2015-07-23T00:00:00
2015-07-23T00:00:00,,Leicestershire (UK/England),triangle,Three anti-gravity triangles.  ((NUFORC Note:  We wonder whether this is a serious-minded report.  PD)),1 minute,2015-07-23T00:00:00
,UT,Sugar House,unknown,I am 72 and this started when I was 5-6 and continued through different parts of my life with different events. I have put it off becau,Unknown,
,WA,Washougal,cylinder,"Late 1960's: bright, white, cylinder-shaped light; no noise, shown twice--a few seconds each time on rooftop.",seconds,
2015-07-11T21:50:00,AR,Marion,circle,"Spherical light in sky, moving at inhuman speed, brightens then disapears",15 seconds,2015-07-17T00:00:00
2015-07-11T22:00:00,LA,Winnfield,unknown,"My 6-year old son and I walked outside to the car, and he says, ""Mom, look at that, it doesn't look like a plane.""",8 minutes,2015-07-17T00:00:00
2015-07-11T22:00:00,OH,Cleveland,unknown,"Sonic boom like sounds, followed by possible fireworks or munitions?",10 minutes +,2015-07-17T00:00:00
2015-07-11T22:08:00,OH,Miamisburg,circle,Looking west from Pipestone Village.  One small light appeared to be descending slowly then broke into three objects. Then disappeared.,60 seconds,2015-07-17T00:00:00
2015-07-11T22:15:00,OH,Oregonia,sphere,"My wife, myself and my granddaughter witnessed a large orange orb hovering low in the sky. It changed to 3 orbs disappeared. Then back",3 minutes,2015-07-17T00:00:00
1982-05-07T20:00:00,AR,Bono,unknown,"All of a sudden sleepiness, appesnece of memory, as if it were summoning them.",,2001-01-03T00:00:00
2015-07-11T22:30:00,FL,Orlando,unknown,"3 red lights flying in the sky from different directions, disappearing in the same spot.",5 minutes,2015-07-17T00:00:00
2015-07-11T22:20:00,PA,Chester Springs,circle,Orange glowing objects coming in from the north.,5 minutes,2015-07-17T00:00:00
2015-07-11T22:30:00,PA,New Kensington,light,About 8-10 lights hovering in a non specific formation. One by one the lights began to fade away in the night sky. Last remained visibl,5 minutes,2015-07-17T00:00:00
2015-07-11T22:35:00,FL,Clermont,circle,An orange-amber glow above horizon then disappears.,10 minutes,2015-07-17T00:00:00
2015-07-11T22:45:00,GA,Byron,formation,"We saw orange lights that seemed to appear out of nowhere.  They went in a line, and at one point 3 of them moved into a triangle.",15 minute,2015-07-17T00:00:00
2015-07-11T23:00:00,VA,Hampton,light,Orange flickering light that makes changes in speed and direction and dissapears behind trees into water.,1 minute,2015-07-17T00:00:00
2015-07-11T23:00:00,WA,Fife,light,"I saw six bright orange lights in the sky over Fife, WA.",4 minutes,2015-07-17T00:00:00
,OH,Dover,formation,6 craft total.  One mother ship.,3 hours,
1970-04-15T21:30:00,IL,Chicago,circle,"Reddish orange spheres (3) seen going south to north in a mechanical, straight line trajectory",1 minute,2015-07-06T00:00:00
1974-10-15T20:00:00,TX,Big Sandy,triangle,"Triangle, colored lights, cow mutilations, disappeared.",90 minutes,2015-07-06T00:00:00
1984-09-01T02:00:00,,Dublin (Republic of Ireland),triangle,"it was large ,black or a dark collor,it hoverd over a train station called heuston train station in dublin city where i worked at the t",8 to 10 mins,2001-01-03T00:00:00
2012-10-21T22:21:00,CA,Daly City,oval,I had just arrived home from a nlcs game loss. We got off the car to go inside and I looked up and noticed the oddity of the moon and c,<1 minute,2015-07-06T00:00:00
2014-06-19T04:00:00,,Puerto Aventuras and Tulum (Mexico),disk,"Encounter with grey followed by picture of UFO same day in Tulum, Mexico",10 minutes,2015-07-06T00:00:00
2014-07-04T22:00:00,WA,Seattle,light,Three distinct orange lights moving silently very near to the Lake Union fireworks display.,~5 minutes,2015-07-06T00:00:00
2015-06-19T12:15:00,BC,Kelowna,changing,Took picture of bright orb and on picture you can see faint outline of a disc shape,33 minutes,2015-07-06T00:00:00
2015-06-20T21:40:00,SC,Columbia,fireball,"Soundless oval fireball - first still, then moving rapidly over Southeast Columbia, SC.",20-30 seconds,2015-07-06T00:00:00
2015-07-02T21:50:00,MI,Pinckney,light,"1 very bright light, 2nd smaller & dim.  Appeared as though one was trailing the other.  ((NUFORC Note:  Venus & Jupiter??  PD))",20 minutes,2015-07-06T00:00:00
2015-07-02T21:57:00,WA,Seattle,circle,"Two saucer-shaped objects streak across Seattle sky, captured with camera.",1 second,2015-07-06T00:00:00
2015-07-02T22:00:00,MI,Livonia,unknown,"Four stationary lights visible for two hours off Seven Mile Road, and Newburgh, in Livonia Michigan-July 2, 2015-10:p.m.-12:00a.m.",2 hours,2015-07-06T00:00:00
2015-07-02T22:20:00,IL,Oswego,fireball,Fireball type lights moving in sky,2 minutes,2015-07-06T00:00:00
2015-07-23T09:45:00,CO,Colorado Springs,light,"Gold metallic object hovering in the blue sky.  ((NUFORC Note:  Photo provided of very small, blurry object.  PD))",30 minutes,2015-07-23T00:00:00
2017-04-29T21:00:00,PA,Chambersburg,disk,2 larger than planet size bell/saucer shapes with bright amber/white light emitting from each hovered briefly then vanished.,1 minute,2017-05-06T00:00:00
1985-07-13T00:00:00,,Biala (Bulgaria),disk,((NUFORC Note:  Witness submits a cryptic report regarding the apparent sighting of a disk.  PD)),,2001-01-03T00:00:00
1973-06-13T23:30:00,PA,Wilkes-Barre,disk,ufo abduction,2 minutes,2015-07-03T00:00:00
1976-07-15T13:00:00,MA,Medford,disk,Disk-Shaped silver craft glided over my home.,20 seconds,2015-07-03T00:00:00
1981-11-14T19:30:00,NE,Wahoo,cigar,"Green neon saucer rose from behind trees to the left, rocked back and forth then accelerated over highway to west then vanished.",~1 minute,2015-07-03T00:00:00
2009-07-19T23:00:00,MT,Poplar,disk,"We were near the Arbor at the Pow Wow grounds visiting when I looked up and said, ""I know I'm not the only one who sees that.""",35 minutes,2015-07-03T00:00:00
2012-09-29T06:50:00,VA,Lively,cylinder,"Adult male witnesses very bizarre-looking ""tube-shaped"" object in the vicinity of his home.",2 seconds,2015-07-03T00:00:00
2013-02-15T01:00:00,TX,Houston,flash,Orb in the sky.,2 minutes,2015-07-03T00:00:00
2013-08-07T20:30:00,FL,West Pompano Beach,other,Three objects in close proximity moving in unison split up into three seperate objects witness by several people on TV. with pictures.,4 minutes,2015-07-03T00:00:00
2014-01-16T18:00:00,SC,North Myrtle Beach,fireball,Multiple UFOs appear out of nowhere and disappear.,5 minutes,2015-07-03T00:00:00
2014-08-20T00:00:00,MI,Mount Pleasant,light,"Steady paced but slow-bobbing light, that takes shooting off into the night within seconds.",~1 minute,2015-07-03T00:00:00
2014-11-01T03:00:00,AZ,Cascabels,disk,Blacked Out Disk Silently Traverses Canyon.,5-10,2015-07-03T00:00:00
1986-06-01T19:00:00,NY,New York,triangle,looking at night sky  a large spaceship the size of football field passed overhead humming . A chill ran through me.,3min.,2001-01-03T00:00:00
2015-01-29T15:30:00,MA,Hampton Beach,sphere,I looked at the pictures on my phone of a sundog and noticed there was something else in my photos.,5 minutes,2015-07-03T00:00:00
2015-02-10T16:00:00,NM,Mora,other,This object was behind a cloud with only part of it exposed. I have this photo to this date. It was accidently caught on a photo i took,1,2015-07-03T00:00:00
2015-03-15T12:00:00,AZ,Surprise,oval,Round disk flat bottom with a white aura around it.,picture,2015-07-03T00:00:00
2015-07-11T23:00:00,VA,Roanoke,,I was sitting outside looking at the sky and noticed a fast moving object.Thought at first it was a plane then noticed that it had circ,2 minutes,2015-07-17T00:00:00
2015-07-11T23:10:00,AZ,Lake Havasu City,changing,Lights moving like no air craft at termendous speeds.,10 minutes,2015-07-17T00:00:00
2015-07-11T23:30:00,LA,Garyville,formation,I witness a swarm of orange flickering orbs rising fron the ground into the sky doing some type of dance.,3 minutes,2015-07-17T00:00:00
2015-07-11T23:45:00,OH,Negley,cylinder,"Slow moving cylinder shaped flashing red lights over tree line on Lake Tomahawk, Negley, OH 23:45 07/11/15",Present,2015-07-17T00:00:00
2015-07-12T00:00:00,CA,Anaheim,fireball,Spinning lights completely disappear in Orange County.,3 seconds,2015-07-17T00:00:00
2015-07-12T00:06:00,CA,Westminster,teardrop,We observed a bright pulsing orange light either in the center or under the object.  It moved very slowly and the stopped and hovered.,9 minutes,2015-07-17T00:00:00
2015-07-12T01:00:00,AZ,Utting,light,I was driving at night south of Parker AZ on hwy 72 near Utting AZ and I saw a light on the left of the road I thought was blinking or,20 minutes,2015-07-17T00:00:00
1988-05-15T15:00:00,MD,Edgewood,sphere,"Edgewood, MD boy sees a chrome sphere move laterally across sky and change directions near the Edgewood Arsenal Army base.",45 seconds,2001-01-03T00:00:00
2015-07-12T01:30:00,NH,Tilton,diamond,"I saw a diamond-shaped strobing object streak across the sky, forming a circular pattern (in a matter of seconds) before disappearing.",14 seconds,2015-07-17T00:00:00
2015-07-12T10:30:00,VA,Virginia Beach,fireball,I was at work at the oceanfront taking the trash out and saw This flying around! It flew towards me then just hovered for a minute and,3 minutes,2015-07-17T00:00:00
2015-07-12T10:40:00,SC,Charleston,light,Three bright white lights moving across the sky stopped abruptly and formed into a triangle and then an L shaped formation.,25 minutes,2015-07-17T00:00:00
2015-07-12T11:06:00,GA,Dublin,circle,I saw a very bright low-hovering red and yellow oval craft.,15 seconds,2015-07-17T00:00:00
2015-07-12T18:00:00,,Lebanon (Middle East??),disk,((HOAX??))  Photographing/circular disk/flying /sky.,few seconds,2015-07-17T00:00:00
2015-07-02T22:40:00,,Ahmedabad (India),sphere,I saw an unidentifiable moving object with red light in between the sphere in the sky.,10 seconds,2015-07-06T00:00:00
2015-07-02T23:43:00,LA,Walker,disk,"Driving south on hwy 447 bright orange saucer type object right above springfield subdivision, no sound ,hoovered 2 minutes at about 30",2+ minutes,2015-07-06T00:00:00
2015-07-03T19:47:00,OH,Columbus,light,Lights blinked and hovered before disappearing.,1 minute,2015-07-06T00:00:00
2015-07-03T21:00:00,AL,Elberta,fireball,Two bright orange fireballs moving from north to south at a high rate of speed.,1-2 minutes,2015-07-06T00:00:00
2015-07-03T21:00:00,GA,Flowery Branch,flash,I was at the Sterling Lake fireworks show tonight and there was an plethora of ufos or drones in the sky. We counted at least 39 of the,90 minutes,2015-07-06T00:00:00
,TX,Timpson,light,"Round lights,blMulticolored lights moving in circles on and around reswidence",1hour 30 min,
2015-07-03T21:20:00,NY,Phoenix,sphere,Ball of light seen in night sky.,15 minutes,2015-07-06T00:00:00
