seen_date,state,city,shape,summary,duration,posted_date
2015-07-03T21:30:00,RI,Pawtucket,light,Possible UFO or military aircraft above McCoy Stadium after the Pawtucket Red Sox - Scranton Willkes-Barre Rail Riders baseball game.,~30 minutes,2015-07-06T00:00:00
2015-07-03T21:30:00,IL,Algonquin,light,"5 Yellow/Orange moving lights seen in sky over Algonquin, Illinois.",3-5 minutes (each),2015-07-06T00:00:00
2015-07-03T21:45:00,ME,Old Orchard Beach,circle,"We were watching the fireworks show at the beach, (what I assumed was) a plane flew into the general vicinity so they actually stopped",15 minutes,2015-07-06T00:00:00
2015-07-03T21:50:00,VT,Montpelier,light,"Red single light object, stationary with quick changing travel patterns to other locations.",20 minutes,2015-07-06T00:00:00
2015-07-03T21:50:00,IL,Niles,light,"Flying object, with alternating randomly alternating red and green lights and a blinking white light.  29 second recorded video.",3-6 minutes,2015-07-06T00:00:00
2015-07-03T22:00:00,MO,Weldon Spring,circle,Orange light appeared suddenly in the sky. It appeared to be much farther away than a commercial aircraft that was also within view. Tr,45 seconds,2015-07-06T00:00:00
2015-03-24T02:45:00,NC,Browns Summit,diamond,"Diamond shape, ruby red, long yellow ""kite tail"", moving upward at incredible speed.",3-4 seconds,2015-07-03T00:00:00
2015-05-24T21:00:00,CA,Visalia,disk,"It was  an orange color and not flashing, and when first noticed the object was moving from the North heading South bound. The object s",5-10 minutes,2015-07-03T00:00:00
2015-05-24T21:37:00,CA,Visalia,disk,"Bright glowing object, seen by 4 people, manuvuer and leave at unbeleivable rate of speed.",5 minutes,2015-07-03T00:00:00
,CA,Running  Springs,disk,Around 7 pm on a tues in oct 1966 on my way home from work   while driving up the rim of the world high way or highway 18 from skyfores,20 min,
2015-06-07T02:30:00,SC,McCormick,circle,"Bright Light Moving over McCormick, SC.",30-45 seconds,2015-07-03T00:00:00
2015-06-13T20:08:00,MN,Boundary Waters,unknown,"Observed 3 times an object passing across the sky, strange lights and movement patterns.",15-30 minutes,2015-07-03T00:00:00
2015-06-14T21:00:00,ME,Rockland,triangle,UFO.,4,2015-07-03T00:00:00
2015-06-16T08:05:00,OR,Banks,circle,Orb shaped object in south eastern sky over Oregon.  ((NUFORC Note:  Lens flare.  PD)),1 minute,2015-07-03T00:00:00
2015-06-17T21:25:00,PA,Nazareth,light,"5-7 very unusual lights were seen hovering in a formation, then disappeared right before our eyes.",30 seconds,2015-07-03T00:00:00
2015-06-19T02:30:00,AZ,Yuma,formation,As I was driving down I-8 W at about 2:30 hrs I noticed a UFO flying in parabolic fashion with the convex point at the highway.,2 minutes,2015-07-03T00:00:00
2015-06-20T00:15:00,NJ,Spring Lake,light,Two orange lights seen flying over the Atlantic Ocean and vanishing in seconds,20 seconds,2015-07-03T00:00:00
2015-06-20T12:05:00,ON,Alexandria,circle,Pink/Red circle with a white spot inside.,,2015-07-03T00:00:00
2015-06-20T22:30:00,SC,McCormick,circle,"Another Bright Light Over McCormick, SC.",30-45 seconds,2015-07-03T00:00:00
2015-06-22T00:00:00,PA,Aspers,light,Orange/amber light approx 200 ft off the ground and effortlessly paces vehicle.  Same light appears within close proximity 3 nights.,3 hours,2015-07-03T00:00:00
1969-08-15T01:00:00,AZ,Unknown,circle,We saw a glowing yellow gold object 50 to 100 yards in diameter hovering above us as though wanting to communicate.,1-3 minutes,2000-12-20T00:00:00
2015-07-12T19:45:00,CO,Mead,triangle,Lights where very bright no sound.,10 minutes,2015-07-17T00:00:00
2015-07-12T20:35:00,VA,Stafford,triangle,"I noticed a bright orange light coming up from the trees, then another and then another in a straight line. They would go diagonal  int",6 minutes,2015-07-17T00:00:00
2015-07-12T20:35:00,NY,New York,circle,Unusual dark craft moving slow across the sky in the bronx.,12 minutes,2015-07-17T00:00:00
2015-07-12T21:00:00,FL,Homestead,circle,((HOAX??)) About 8 or so fire red lights circled the sky and disappeared and reappeared for about 10 minutes.,10 minutes,2015-07-17T00:00:00
2015-07-12T21:10:00,MI,Canton,triangle,Observed craft 4-6 minutes in one spot.  Body was perfect triangle with leading lights at each corner.  Lights pulsating red and white.,5 minutes,2015-07-17T00:00:00
2015-07-12T21:15:00,SC,Anderson,teardrop,Bright white Lights.  No flashing qualities of comm. aviation.  1 mi. ahead from coordinates in car when images were taken.,55 seconds,2015-07-17T00:00:00
2015-07-12T21:35:00,NY,Syracuse,fireball,"Glimmering, silent orange disc",3 minutes,2015-07-17T00:00:00
2015-07-12T21:38:00,PA,Laurys Station,sphere,"Orange sphere, as it turned there was a trail behind it.",3 minutes,2015-07-17T00:00:00
2015-07-12T22:00:00,MI,Clinton,unknown,2 White Lights appearing nightly in SE Michigan Sky - appear to change color & shape.  ((NUFORC Note:  Venus and Jupiter?  PD)),Hours (nightly),2015-07-17T00:00:00
2015-07-12T22:00:00,NY,North Tonawanda,triangle,Red pulsing lights in triangular shape moving in northeastern sky.,<10 minutes,2015-07-17T00:00:00
1970-07-13T19:00:00,PR,Barranquitas,other,"The object that I saw, up close and personal,chose me.  It did'nt just fall from the sky. It was put there.",1 minute,2000-12-20T00:00:00
2015-07-12T22:00:00,CA,Huntington Beach,,"From my backyard in Huntington Beach, CA, at about 22:00 hours, looking in the direction of about 30 degrees above east-south-east, I o",1 second,2015-07-17T00:00:00
2015-07-12T22:00:00,RI,Narragansett,fireball,"Extremely bright reddish orange pod/egg-shaped obj. moving NE over Narragansett Bay near Ocean Rd; followed coast, then E.",5-10 minutes,2015-07-17T00:00:00
2015-07-03T22:00:00,WA,Post Falls,light,Red/Green light over fireworks show.,30 minutes,2015-07-06T00:00:00
2015-07-03T22:00:00,CO,Westminster,circle,Watching fireworks on my roof with my husband when from the south of Westminster 5 round bright orange objects streamed across the sky,2 minutes,2015-07-06T00:00:00
2015-07-03T22:00:00,NY,Henderson Bay,light,Objects over Lake Ontario.,5 minutes,2015-07-06T00:00:00
2015-07-03T22:03:00,PA,Altoona,fireball,Strange Fireball with no Sound and Pausing in the night sky.,3 minutes,2015-07-06T00:00:00
2015-07-03T22:15:00,MI,Tyrone Township,sphere,Red pulsating light adjacent to Saturn and Venus.,5 minutes,2015-07-06T00:00:00
2015-07-03T22:15:00,MI,Bangor and Bloomingdale,formation,5 Steady Pink/Red Lights in Zig-Zag Formation,6 minutes,2015-07-06T00:00:00
2015-07-03T22:18:00,OR,Lakeside,fireball,"Orange orb (fireball) over Ten Mile Lake, in Lakeside, OR; moving toward the coast, then south.",4-5 minutes,2015-07-06T00:00:00
2015-07-03T22:30:00,IL,North Aurora,other,"Fire-propelled, non-lantern, non-drone UFO very visible and caught on video.",5 minutes,2015-07-06T00:00:00
1972-09-03T15:00:00,PR,Mayaguez,oval,"It came out of nowhere as I stood in the open lot, I just stood there in awe, unable to  move, a 12 years old witnessing a once in a li",00:05,2000-12-20T00:00:00
2015-07-03T22:30:00,NE,York,light,"Two flickering orange objects sighted twice over in 1.5 hours time over York, Nebraska.",3 minutes,2015-07-06T00:00:00
2015-07-03T22:47:00,IN,Fairland,light,WAS WATCHING THE FIREWORKS SHOW AT INDIANA GRAND CASINO WHEN I NOTICED A LIGHT HOVERING IN THE SKY AROUND THE SHOW.,30 minutes,2015-07-06T00:00:00
2015-07-03T22:50:00,MI,Marquette,light,Red star light object moved suddenly.,1-2 minutes,2015-07-06T00:00:00
2015-07-03T23:00:00,NC,Nags Head,light,"Three bright red lights traveling over ocean, Nags Head, NC.",3-4 minutes,2015-07-06T00:00:00
2015-06-22T06:30:00,WA,Ritzville,disk,"Large disc-shaped craft seen from aircraft near Ritzville, Wa.",5-6 minutes,2015-07-03T00:00:00
2015-06-22T14:00:00,WA,Puyallup,unknown,If just was dark for a few seconds. we did not hear a air liner outside.,1 second,2015-07-03T00:00:00
2015-06-22T20:02:00,CA,Long Beach,egg,"Double egg shape with gold like mid section.  ((NUFORC Note:  Image in video looks to us to be a jet aircraft, at mid altitude.  PD))",15 minutes,2015-07-03T00:00:00
2015-06-22T20:02:00,CA,Long Beach,,White double egg like shaped object with a gold midsection.,4 minutes,2015-07-03T00:00:00
2015-06-22T22:00:00,AZ,Sedona,triangle,"2 triangle shape amber colored UFOs, making a turn in unison, are witnessed by 7 ppl. in Sedona, AZ",2 minutes,2015-07-03T00:00:00
2015-06-22T23:00:00,WV,Cameo,other,I walked out in my back yard and looked up at the stars. There was only 1 cloud in the sky almost strait  overhead. I would look back o,5 minutes,2015-07-03T00:00:00
1989-06-15T00:00:00,MO,Kansas City,changing,"Tumbling, white object which appeared to be disintegrating.",20 seconds,2001-01-03T00:00:00
2015-06-23T01:00:00,MI,Grand Rapids,triangle,"Four white triangular objects with green lights underneath, closely followed by a smaller, circular, white object, looked like a star.",30 seconds,2015-07-03T00:00:00
2015-06-23T01:30:00,MT,Trout Creek,fireball,2 witnesses see a bright neon green fireball with a tail seen in the sky over Montana.,5 seconds,2015-07-03T00:00:00
2015-06-23T18:21:00,NY,Forest Hills,circle,"A circular craft came from North to my house yard. Spinning counter clock wise . 25' to 30'  object, haze around. 2:00 event.",2:00 minutes,2015-07-03T00:00:00
2015-06-23T18:21:00,NY,Forest Hills,circle,"Circular craft came from North spinning, settled on ground 2:00 minutes, no spin. Take off high speed. 5 pictures only.",2:00 minutes,2015-07-03T00:00:00
2015-06-23T21:00:00,MO,Union,changing,"Around 9 pm in the town of Union, MO, on the night of June 23, 2015, there were two to three lights at various time.",1 hour,2015-07-03T00:00:00
2015-06-23T22:35:00,OH,Blue Ash,unknown,"Two abnormal red lights, one pulsing, extremely loud.",10 seconds,2015-07-03T00:00:00
2015-07-12T22:10:00,IL,Highwood,unknown,"Light red coming from est to west, turn left and go nort-est. Color red turn orange , and changed white. Sky clear and temperature 70 f",3 minutes,2015-07-17T00:00:00
2015-07-12T22:30:00,IL,Machesney Park,triangle,"We were heading north on 251 near Forest Hills Road.  We saw a huge triangular type ship in the sky; green, red, purple colors.",Driving home,2015-07-17T00:00:00
2015-07-13T00:00:00,WA,Port Angeles,sphere,"Bright, star like but too close, multicolored orbs hovering and moving back and forth, seem to give off rays or beams.",continuous,2015-07-17T00:00:00
2015-07-13T02:00:00,,Inarajan (Guam),light,Orange glowing light in sky that responded to my flashing light.,,2015-07-17T00:00:00
,MI,Saint Joseph,light,3 bright lights over Lake Michigan late 1960s,5 minutes,
2015-07-13T04:30:00,,Multan (Pakistan),fireball,((HOAX??))  An red light-emitting star-like object moving in various direction and disappeared.,10 minutes,2015-07-17T00:00:00
2015-07-13T16:15:00,AZ,Tucson,sphere,"I saw a black spherical shaped object moving easterly direction, first saw it when it was over Davis monthan air force Base, I would sa",30 seconds,2015-07-17T00:00:00
2015-07-13T21:15:00,AZ,Tucson,changing,Lights in the distance.,20 minutes,2015-07-17T00:00:00
2015-07-13T21:30:00,AZ,Buckeye,light,"One, then two lights turning off and on moving across the southern Arizona sky",40-60 seconds,2015-07-17T00:00:00
2015-07-13T21:30:00,FL,Green Cove Springs,other,We took our dog for a walk and when we looked up to the sky we seen something in the sky there was no noise. it looked to be long with,45 seconds,2015-07-17T00:00:00
2015-07-13T21:54:00,CA,Firebaugh,light,"White light flashes at Mercey Hot Springs, yet again!",2 seconds,2015-07-17T00:00:00
2015-07-13T22:00:00,CA,Monterey,unknown,"Red light spheres hovering 1.5 hrs over marine canyon in Monterey Bay, 5-miles off Moss Landing, leaving & returning to same spot",1.5 hours,2015-07-17T00:00:00
2015-07-13T22:30:00,NY,Fishkill,light,"Orange lights moving SW to NE in separate groups of one to three, over a 10 minute period.",10 minutes,2015-07-17T00:00:00
2015-07-13T23:00:00,IA,Dubuque,light,Large craft moving then ceasing along w/ some sort of lighted craft that entered the view of the 'star' lit like craft.,15 minutes,2015-07-17T00:00:00
2015-06-24T02:00:00,ID,Boise,fireball,"Orange fireball in West Boise.  May have landed near Cole street. No noise,",2 minutes,2015-07-03T00:00:00
2017-04-29T22:00:00,OR,Medford,changing,Hovering multicolored object over Medford,30 seconds,2017-05-06T00:00:00
1989-10-15T19:00:00,AR,Batesville,disk,"It didn't seem harmful, it was like it was observing.",8 min,2001-01-03T00:00:00
2015-07-03T23:00:00,FL,Pinellas Park,light,"3 glowing object sightings within hour, 6 witnesses; FL",1.5-2.5 minutes,2015-07-06T00:00:00
2015-07-04T00:00:00,NJ,Seacaucus,sphere,At a July 4 BBQ saw a sphere shape hovering over New Jersey near Newark airport.  It displayed a bright Red & Green light.  ( not a/c.),2 minutes,2015-07-06T00:00:00
2015-07-04T00:00:00,MS,Ocean Springs,fireball,Sittin on the front porch around 11pm-midnight when me and my two roommates notice this red fireball like orb appear in the sky towards,5 minutes,2015-07-06T00:00:00
2015-07-04T00:00:00,NM,Albuquerque,fireball,"4 red fireball like ufos hovering around Albuquerque, New Mexico.",1 minute,2015-07-06T00:00:00
2015-07-04T00:15:00,MO,Chillicothe,circle,Light I can't identify in North Missouri sky,15 seconds,2015-07-06T00:00:00
2015-07-04T00:23:00,PA,Hatboro,circle,4 white circular objects were spotted behind a very high cloud layer. The original shape was a straight line then 3 of the 4 bright whi,20 seconds,2015-07-06T00:00:00
2015-07-04T00:25:00,OH,Toledo,fireball,"Watched 2 fireballs disappear/reappear, turn red then vanish.",3 minutes,2015-07-06T00:00:00
2015-07-04T01:15:00,CA,Carmichael,disk,"Had three circular blinking lights on the edge. And was defending south west from a distance, it was not real close to me.",10,2015-07-06T00:00:00
2015-07-04T02:45:00,AZ,Mesa,light,"Top of hill, South Central Mesa, AZ, close to Interstate 60 Distance: approx. 0.5 mile from observer, facing north.",90 minutes,2015-07-06T00:00:00
2015-07-04T00:30:00,WI,Manitowoc,light,3 white and red lights.,45 minutes,2015-07-06T00:00:00
1991-06-15T03:00:00,FL,North Lauderdale,other,WOKE UP IN MIDDLE OF NIGHT TO BRIGHT LIGHT IN LIVING ROOM. SAW BLUE/GRAY HOODED CLOAK. LOOKED TWICE A MESSAGE WENT IN MY HEAD TO GO BAC,?,2001-01-03T00:00:00
2015-07-04T16:40:00,NJ,Toms River,rectangle,Postcard in the sky.,2-3 minutes,2015-07-06T00:00:00
2015-06-24T09:46:00,RI,Providence,light,I seen a bright blue light that seemed to get dim then glow red then started moving at a slow pace then 2 other pulsating lights coming,5 minutes,2015-07-03T00:00:00
2015-06-24T15:15:00,FL,Orlando,cigar,One large and 3 smaller object in a clear sky,20-25 minutes,2015-07-03T00:00:00
2015-06-24T16:50:00,OR,Banks,other,Liquid metal bus saucer morphs eastward in Oregon sky.,1 minute,2015-07-03T00:00:00
2015-06-24T21:00:00,FL,Punta Gorda,oval,Fixed oval light in sky with 4-5 rings.,1-2 hours,2015-07-03T00:00:00
2015-06-24T22:05:00,NC,Asheboro,light,"Orange light crossed in front of me while driving and hovered above the trees, moving in a westward direction on an overcast night.",2 minutes,2015-07-03T00:00:00
2015-06-24T22:10:00,CA,Livermore,cylinder,"Two craft over Northern California, traveling at a high rate of speed, chasing each other, with no sound.",30 seconds,2015-07-03T00:00:00
2015-06-24T23:10:00,,Chandigarh (India),fireball,"Fireball UFO, definite that its not a meteorite or a crashing plane.",3 minutes,2015-07-03T00:00:00
2015-06-24T22:30:00,TX,Cypress,sphere,My husband ran into the house and said a huge bright light. He said it was dimming and then very bright.I witnessed a yellow ball and i,1 hour,2015-07-03T00:00:00
2015-06-25T02:50:00,WA,Lakebay,triangle,"Observed what at first believed to be a ""slow"" falling star, which evolved into dark triangular objects flying in a line.",60 seconds,2015-07-03T00:00:00
1992-05-01T03:00:00,WA,Coupeville,sphere,I was sitting on a bed in a house which had windows all along the backside of the house facing north. These windows had a view of an in,15 seconds,2001-01-03T00:00:00
2015-06-25T05:30:00,IN,Indianapolis,flash,"Bright beam of light from ground up, then rumbling passing over the house for around 10-15 minutes, making the house shake.",10 minutes,2015-07-03T00:00:00
2015-06-25T10:30:00,WA,Lacey,circle,"Bright flashing orb spotted in broad daylight over Lacey, WA.",15 minutes,2015-07-03T00:00:00
2015-06-25T16:30:00,PA,Philadelphia,oval,((Blimp?)) At first I thought it was a blimp but when I looked closer I saw that it was flat on the bottom.  Blimps aren't flat.,45 seconds,2015-07-03T00:00:00
2015-07-13T23:00:00,ON,Toronto,light,"The movements were too sharp, and too precise, and fast.",10 seconds,2015-07-17T00:00:00
2015-07-14T00:00:00,MT,Sidney,fireball,Orb of light flickers but then disappears.,,2015-07-17T00:00:00
2015-07-14T03:30:00,ON,Cambridge,disk,2 small flying crafts passing slowly over my neighbourhood.,1-2 minutes,2015-07-17T00:00:00
2015-07-14T21:15:00,WI,Baileys Harbor,fireball,Low flying orange red sphere seen between Cana Island and Baileys Harbor in Wisconsin,,2015-07-17T00:00:00
2015-07-14T17:10:00,OR,Salem,circle,"UFO sighted in Salem, OR, over park at around height of airplanes and is white and shiny with translucent halo blinks out & comes back.",4 minutes,2015-07-17T00:00:00
2015-07-14T21:20:00,NV,Las Vegas,light,"A little white dot/UFO flying over Las Vegas very slowly, then vanished into outer space.",,2015-07-17T00:00:00
2015-07-14T21:30:00,TN,Hixson,unknown,V-shape look like lightning.  It was going up.  One side seemed bigger as it was going up.  Both sides was blinking.  Hear loud booms.,20 seconds,2015-07-17T00:00:00
1993-06-26T02:30:00,CO,Holy Cross Wilderness Area,light,I was alone camping in the mountains and was awakened by strange noises and an intense bright light that seemed unearthly.,45 min,2001-01-03T00:00:00
2015-07-14T21:30:00,FL,St. Petersburg,light,"Bright round light appears, then pulsates and vanishes.",1 minute,2015-07-17T00:00:00
2015-07-14T22:30:00,NV,Ely,disk,A UFO followed us while driving in Nevada few nights ago.,20 minutes,2015-07-17T00:00:00
2015-07-14T22:45:00,NY,Patchogue,light,"An orange glowing ball was hovering near Canaan Lake then disappeared, reappearing and flying silently across the sky.",5 minutes,2015-07-17T00:00:00
2015-07-04T17:00:00,MO,Independence,other,Low flying and extremely loud sound over house.,25-30 seconds,2015-07-06T00:00:00
2015-07-04T18:30:00,WA,Tacoma,fireball,"5 red objects stationary, not resembling lights, planes, or fireworks. One move downward and over. Then two went toward horizon and ove",3 minutes,2015-07-06T00:00:00
2015-07-04T19:40:00,NY,Plainview,rectangle,"I just saw four lights in the sky in plain view.  They made a perfect square and hovered above my car, and stayed in the same spot.",A few minutes,2015-07-06T00:00:00
2015-07-04T19:15:00,NY,Syracuse,oval,1 bright oval shape and 2 acorn orange fireballs,35 minutes,2015-07-06T00:00:00
2015-07-04T20:00:00,FL,Wellington,diamond,Orange-yellow light surrounding a craft hovering.,10 minutes,2015-07-06T00:00:00
2015-07-04T20:00:00,OH,Strasburg,circle,Follow up to prior report.,20 minutes,2015-07-06T00:00:00
2015-07-04T20:30:00,OH,Strasburg,sphere,6 UFO's. Brilliant RED.  Larger than commercial aircraft.  Faster than commercial aircraft. No sound.,20 minutes,2015-07-06T00:00:00
1994-12-29T23:10:00,NY,Oppenhium,oval,"A large kitchen table sized, ovel with lights going around it went past my house not making a sound.",about 5 min.,2001-01-03T00:00:00
2015-07-04T20:30:00,CA,Redlands,light,"Strange Amber-Orange Light seen in Redlands, California, on July 4th.",30-45 seconds,2015-07-06T00:00:00
2015-07-04T20:45:00,SC,Surfside Beach,circle,Orange craft/s over Surfside Beach during the 4th of july fireworks!!!,>30 minutes,2015-07-06T00:00:00
2015-07-04T20:47:00,NY,Poughkeepsie,unknown,Craft appeared with green and white strobe lights. Unable to determine shape. Flying object appeared 4x 's. Each time during and after,4:47,2015-07-06T00:00:00
2015-07-04T20:55:00,IL,Chicago,fireball,This was NOT a firework.,Not sure,2015-07-06T00:00:00
2015-06-25T19:50:00,MO,Arnold,sphere,A metallic sphere colored gold was hovering stationary approximately 50 feet above the side of the road. The sphere had three fins runn,5,2015-07-03T00:00:00
2015-06-25T20:30:00,MA,Sandwich,light,I was with a group of people out on Sandy Neck Beach in Barnstable last night. The sky was very cloudy and the only celestial light tha,3-5 minutes,2015-07-03T00:00:00
2015-06-25T20:50:00,NV,Las Vegas,circle,"Round, red and green object hovering over mountains of northern Las Vegas",5,2015-07-03T00:00:00
2015-06-25T21:45:00,KS,Lawrence,unknown,Object with pulsing wave of light moving around it,5 minutes,2015-07-03T00:00:00
2015-06-25T21:50:00,NJ,Jackson,unknown,Weird 2 light turn counter clock wise until one light then gone.,2 minutes,2015-07-03T00:00:00
2015-06-25T22:05:00,CT,Milford,sphere,"3 Spherical UFO's sighted over Long Island Sound, CT",10 minutes,2015-07-03T00:00:00
1996-03-15T18:00:00,TX,Houston,changing,"I WAS WALKING OUT MY BACK DOOR AND LOOKED UP AND SAW A SHAPE MOVING FROM SOUTH TO NORTH ABOUT AS FAST AS A SMALL PLANE, IT WAS CHANGING",15 MIN,2001-01-03T00:00:00
2015-06-26T01:05:00,RI,Coventry,other,"Driving down I-95 S, coming home from a friend's passing exit 6a I took a picture with my phone of the moon because it was eluminingat",20 seconds,2015-07-03T00:00:00
2015-06-26T01:30:00,MI,South Haven,light,A series of green rectangular lights in the sky.,30 seconds,2015-07-03T00:00:00
2015-06-26T03:30:00,MA,Townsend,chevron,Saw triangular silent slow moving craft go over house above treeline. White and red flashing lights at points on craft.,6 minutes,2015-07-03T00:00:00
2015-07-14T22:45:00,FL,Oviedo,triangle,"Triangle shape craft was hovering about 400 feet above. Craft did not produce any sound. It had 5 blinking lights underneath, one of th",~3 minutes,2015-07-17T00:00:00
2015-06-26T01:30:00,NY,Rochester,formation,4 orange balls of light in the sky above Park Avenue.,1 minute,2015-07-03T00:00:00
2015-07-14T23:00:00,OR,Dexter,flash,"Irregular flashes across far southern skyline near Dexter, OR.  No near or distant storms.",20 minutes,2015-07-17T00:00:00
2015-07-14T23:10:00,IL,Oak Lawn,light,This happened to me for the 3rd time in the last 10 months.,15 seconds,2015-07-17T00:00:00
2015-07-14T23:20:00,SC,West Columbia,light,Strobe like light.,2 minutes,2015-07-17T00:00:00
2015-07-15T00:00:00,WA,Kelso,fireball,"Orange fireball with a tail traveling at fast speed in Kelso WA, changed direction abruptly, came by 3x this week",1 minute,2015-07-17T00:00:00
2015-07-15T00:10:00,MI,Gladwin,triangle,"Something glowed brightly, stood motionless for a few seconds, flared up and took off across the sky.",30-40 seconds,2015-07-17T00:00:00
1997-06-01T19:00:00,CA,El Centro,chevron,The big v shape UFO was moving in a slow motion towards the super Kmart in El Centro CA. when I saw it outside the store.,minutes,2001-01-03T00:00:00
2015-07-15T07:15:00,NC,Greensboro,sphere,UFO meanders through the morning sky followed by a military plane.,10 minutes,2015-07-17T00:00:00
2015-07-15T20:40:00,CA,Sacramento,fireball,"Driving north on Bruceville Rd. from Elk Grove to Sacramento and saw a very long laser like red line, streaking across the sky from the",5-6 minutes,2015-07-17T00:00:00
2015-07-15T21:50:00,OH,Columbus,changing,I was outside with my younger brothers they had went inside but shortly after these lighs fly at angle at a distance they did not forum,1-2 minutes,2015-07-17T00:00:00
2015-07-15T22:00:00,MO,Oak Grove,cylinder,"Bright orangish red spherical object moving from SE to NW of Oak Grove, MO.",30-60 seconds,2015-07-17T00:00:00
2015-07-15T22:11:00,CA,Torrance,triangle,"A triangle of light nose diving/falling from the sky, lost sight of it behind trees.  ((NUFORC Note:  Possible model a/c?  PD))",3 seconds,2015-07-17T00:00:00
2015-07-16T00:00:00,PA,Morrisville,triangle,Huge dark object high in the clouds hovering over me.,6 minutes,2015-07-17T00:00:00
2015-07-04T21:00:00,MA,Greenfield,light,"Bright yellow pulsing or moving slowly upwards. Caught on camera and on video. Silent, peaceful, disappeared into overcast sky.",2 minutes,2015-07-06T00:00:00
2015-07-04T21:00:00,CA,Mira Loma,light,"Object with white, red and green lights was hovering in the sky for about five minutes.",5 minutes,2015-07-06T00:00:00
2015-07-04T21:00:00,MN,Backus,,Reddish orb floating across the sky about basketball size right above the cabins about 100 150 feet above land. Saw it from land and my,3,2015-07-06T00:00:00
2015-07-04T21:00:00,WI,Green Bay,oval,"Bright orange-yellow light flying fast in one dir., hovered for a few mins, then sped off into the distance and disappeared.",15 minutes,2015-07-06T00:00:00
1997-09-15T15:00:00,CO,Colorado Springs,rectangle,"The object was about one hundred and fifty feet long, and fifty feet wide. It was greyish black in color, I think the object was about ",,2001-01-03T00:00:00
2015-07-04T21:00:00,NV,Las Vegas,sphere,GLOWING ORB OVER LAS VEGAS JULY 4th 2015.,7 minutes,2015-07-06T00:00:00
2015-07-04T21:00:00,RI,Providence,formation,8 disc shaped crafts w/4 or 5 orange lights...they made no noise whatsoever and they should have if they were produced on this planet.,5-7 minutes,2015-07-06T00:00:00
2015-07-04T21:00:00,MD,Sykesville,fireball,The objects just looked like bright orange lights rising slowly  out of  sight.,10 minutes,2015-07-06T00:00:00
2015-07-04T21:00:00,MA,Worcester,circle,Red lights in V-formation; disappear in same spot in sky; no sound.,5 minutes,2015-07-06T00:00:00
