seen_date,state,city,shape,summary,duration,posted_date
,OR,Salem,disk,"Three saucer shaped ships.  High in the sky, metallic but no shine.  Rather dull gray.  They hovered overhead in a V formation.",15 minutes,
,ME,Ellsworth,teardrop,Tear-drop shaped silent craft with sectional front end.,5 minutes,
2017-03-17T02:00:00,MD,Rockville,changing,"Two UFOs over Rockville, MD.  ((anonymous report))  ((NUFORC Note:  Possible sighting of stars, we wonder??  PD))",5,2017-03-17T00:00:00
1996-08-15T02:30:00,MI,Grand Rapids,light,We saw two red dots of apparent unearthly origin.,20 minutes,1998-03-07T00:00:00
2017-04-29T19:05:00,NJ,Fords,other,CAPSULE SHAPED CRAFT RAPIDLY DESCENDS INTO WAREHOUSE PARK.,30 seconds,2017-05-06T00:00:00
2000-09-09T22:30:00,GA,Dahlonega,changing,A stationary bowl shaped object with colored lights.,at least 1 hour,2000-09-17T00:00:00
2015-07-25T01:15:00,,Praia da Vitoria (Azores)(Portugal),other,"I am a police officer in Portugal, Azores, Terceira Island, in the city of Praia da Vitoria. Tonight i was arriving home from my night",30 seconds,2015-07-31T00:00:00
2015-07-25T03:00:00,WA,Tumwater,fireball,Two bright orange lights through the trees.  ((NUFORC Note:  Red lights located on tops of two towers.  PD)),Ongoing,2015-07-31T00:00:00
2015-07-25T10:40:00,IL,Neoga,fireball,Never seen anything like that before. Definitely not a firework. Definitely lasted a good deal of time. It was quite bright. Not a mete,1-2 minutes,2015-07-31T00:00:00
2015-07-25T16:45:00,TX,Hutto,triangle,The photo I took had a total of three objects.,5 minutes,2015-07-31T00:00:00
2015-07-25T18:40:00,AZ,Tempe,light,Lights over North Tempe.,5 minutes,2015-07-31T00:00:00
2015-07-25T18:42:00,VA,Hampton,light,2 white dots in the eastern sky higher than 35k feet.,25 minutes,2015-07-31T00:00:00
2015-07-25T20:15:00,MN,Saint Paul,rectangle,"One larger object, w/ 4 smaller obj.s hovering nearby.  The 4 smaller units disappeared up into clouds.",30 minutes,2015-07-31T00:00:00
2015-07-25T20:30:00,WV,Wayne,unknown,I saw a silver orb.,3 minutes,2015-07-31T00:00:00
2015-07-25T21:07:00,WI,Milwaukee,unknown,Object moving downward with orange glow then suddenly disappeared.,2 minutes,2015-07-31T00:00:00
2015-07-25T21:00:00,WI,Milwaukee,sphere,"Flaming object split into 5 blue orbs, formed a trapeziod then disappeared.",3 minutes,2015-07-31T00:00:00
2000-09-10T19:10:00,IL,Chicago,other,Black object hovering across the sky.,5 min.,2000-09-17T00:00:00
2015-07-25T21:45:00,CA,Salinas,light,There's a blue light inside of the clouds and marine layer. The blue light is inside of the clouds only in one space glowing.,1 hour +,2015-07-31T00:00:00
2015-07-25T21:50:00,NY,Merrick,light,"Silent red light moved across the sky from south to north, changed course, and went off to the northwest.",1-2 minutes,2015-07-31T00:00:00
2015-09-02T17:00:00,NC,Graham,cross,"White, cross-shaped, object, followed by a dark oval shaped object.",2 minutes,2015-09-02T00:00:00
2015-07-31T20:40:00,CA,Coalinga,light,Very bright as compared to star background.  Definitely not an airplane; too fast no flashing lights.  Traveled about 110 deg arc.,5 minutes,2015-08-06T00:00:00
2015-07-31T21:00:00,NY,Auburn,fireball,"Orange flaming ball of fire, flying west to east, with no sound or navigation lights.",30 seconds,2015-08-06T00:00:00
2015-07-31T21:00:00,IL,Woodstock,circle,"My husband and I saw a round, orange object travel in a straight southerly direction then it got smaller and disappeared.",3-4 minutes,2015-08-06T00:00:00
2015-07-31T21:00:00,ME,Windham,light,"Very bright object observed in Maine, quite high & distant, moving very steadily across sky, covering a great distance.",5 minutes,2015-08-06T00:00:00
2015-07-31T21:00:00,NJ,Somerville,unknown,"3 objects with lights, spotted in triangular formation while driving on RT 287.",15 minutes,2015-08-06T00:00:00
2015-07-31T21:00:00,IL,Johnsburg,oval,"Slow, Low, from Northwest to Southeast, vertical unblinking lights, then disappeared.",1 minute,2015-08-06T00:00:00
2015-07-31T21:30:00,OR,Bend,light,I witnessed a object with a bright light come from the south and moved East disappearing. It had a bright white light that appeared bri,1 minute,2015-08-06T00:00:00
2000-09-10T20:30:00,OK,Edmond,light,I saw what looked like a shooting star and noticed the head of the light was shaped in a perfect triangle,30 seconds,2000-09-17T00:00:00
2015-07-31T21:34:00,OR,Bandon,circle,Daughter and I were sitting in her room and heard this super loud firecracker yet metallic metal steel drum boom kind of sound outside.,3 minutes,2015-08-06T00:00:00
2015-07-31T21:45:00,IL,Frankfort,circle,"One adult male and adult female witnessed 6 crafts, one orange the others orange, went from flew overhead and blinked out one by one.",5 minutes,2015-08-06T00:00:00
2015-07-31T21:35:00,NJ,Edison,light,"White light, almost like a star.",<1 minute,2015-08-06T00:00:00
2015-07-31T21:45:00,CT,Suffield,light,"Seemed like planet or bright star (white light), but then moved around in small area.",45 minutes +,2015-08-06T00:00:00
2015-07-31T21:56:00,NH,Salem,light,Light High.,15 seconds,2015-08-06T00:00:00
2015-07-25T22:00:00,CO,Broomfield,changing,Iridescent dots meandering through the sky in various formations.,5 minutes,2015-07-31T00:00:00
2015-07-25T22:30:00,CA,Irvine,triangle,Hovering craft with red and green blinking lights.  Hovers for a minute and then moved to a new spot.,5 minutes,2015-07-31T00:00:00
2015-07-25T23:00:00,MI,Muskegon,light,Mysterious single bright light flashes over West Michigan.,~30 seconds,2015-07-31T00:00:00
2015-07-25T23:02:00,CA,Antelope,flash,"Craft had 3 parts. Round flashing large object. Hovered silently for about 15 minutes then slowly moved south, until it disappeared beh",15 minutes,2015-07-31T00:00:00
2015-07-26T00:05:00,,Redhill (UK/England),circle,A luminous red sphere with red halo effect hanging still in black night sky; eighth the size of the moon.,3minutes,2015-07-31T00:00:00
2000-09-10T21:00:00,CO,Denver,triangle,triangle object withred lights on points and white light in center,2 minutes,2000-09-17T00:00:00
2015-07-26T01:00:00,FL,Spring Hill,other,"Nightly activities hovering in the sky,A sphere UFO with beautiful lights that change colors but remain green a few of them get togethe",All night,2015-07-31T00:00:00
2015-07-26T01:45:00,NY,New York,fireball,"4 orange colored balls, moving from south to east. glided low and took off and disappeared in 2 mins.  There was helicopter activity 30",2 minutes,2015-07-31T00:00:00
2015-07-26T08:15:00,CA,Whittier,,"Saw 3 round object with red bright lights. They were moving lightly, then all of the sudden they took off.",2 minutes,2015-07-31T00:00:00
2015-07-26T03:00:00,NY,Alden,light,Satelite looking objects moving unintelligibly with shocking ability to change direction and stop.,2.5-3 hours,2015-07-31T00:00:00
2015-07-26T13:00:00,,Johannesburg (South Africa),sphere,"Report of 50+ balls of light and 2-3 Massive ships appearing in South Africa, above Johannesburg.",">5 hours, and continu",2015-07-31T00:00:00
2015-07-26T18:30:00,CO,Broomfield,circle,Circular ferris wheel object with bright lights moving across the sky.,4 minutes,2015-07-31T00:00:00
2015-07-26T20:35:00,FL,Cutler Bay,oval,Round light moving across the sky . hovered and changed colors,15 minutes,2015-07-31T00:00:00
2015-07-31T22:00:00,MN,Richmond,flash,"Looking S near Richmond, MN.  It was a horizontal flash, larger than a jet in three separate jagged lines...not lightning.",2 seconds,2015-08-06T00:00:00
2015-07-31T22:05:00,IL,Buffalo Grove,light,"Bright starlike object with changing speeds and floating movement at very high altitude moving W to E, without dimming in intensity.",5 minutes,2015-08-06T00:00:00
2015-07-31T22:15:00,VT,Saint Johnsbury,sphere,Unexplained Bright White Lights Over Saint Johnsbury Vermont!!,10 minutes,2015-08-06T00:00:00
2000-09-10T21:10:00,MN,Hermantown,triangle,my feiance and I were driving home from a weekend out of town. We were driving south on hwy 53 just north of hermantown minnesota..When,5 minutes,2000-09-17T00:00:00
2015-07-31T22:16:00,QC,Venise en Quebec,egg,"Orange, egg-shaped orb over Venise end Quebec",5 minutes,2015-08-06T00:00:00
2015-07-31T22:40:00,NC,Salvo,fireball,"Large and bright red fireball or light, silent and very fast moving N, and then nearly 90 degree westward turn over Pamlico Sound.",1 minute,2015-08-06T00:00:00
2015-07-31T23:00:00,CA,Stockton,sphere,Seven Beautiful luminous orange orange orbs dance away above Stockton California,2 minutes,2015-08-06T00:00:00
2015-07-31T23:00:00,OH,Dublin,triangle,((HOAX??))  triangle craft with bright green lights and fast not very loud at all.,fast,2015-08-06T00:00:00
2015-07-31T23:00:00,MD,West Friendship,egg,"Pictures and video of blue egg shaped orb.  ((NUFORC Note:  Lens flares, caused by pointing a camera at a bright source of light.  PD))",2-3 minutes,2015-08-06T00:00:00
2015-07-31T23:00:00,MA,Orleans,cylinder,Very bright object from the west moving east over Orleans MA 7-31-15.,2 minutes,2015-08-06T00:00:00
2015-07-31T23:00:00,TN,Old Hickory,light,"Seen flashing over Old Hickory Lake, going towards Mount Juliet.",3 minutes,2015-08-06T00:00:00
2015-07-31T23:50:00,ME,Scarborough,circle,"Ball-shaped green light zooms through the sky, stops, then continues.",5 seconds,2015-08-06T00:00:00
2015-08-01T00:30:00,OH,Miamisburg,disk,My b.f. and I were stargazing on our back porch after I told him I saw a very vivid and long falling star trail.,2 minutes,2015-08-06T00:00:00
2015-07-26T21:30:00,VA,Bristol,triangle,"I seen a red light under the moon and then I seen another one about 30 feet away, while I was looking at them a two green triangles.",30,2015-07-31T00:00:00
2000-09-10T22:00:00,MD,Patuxent River,light,I had three sightings exactly like the Hagertown sighting on 01/16/00. The first (04/28/98) was on Rt. 270 South near the Boyds exit. T,5 seconds,2000-09-17T00:00:00
2015-07-26T21:45:00,WY,Beloit,fireball,"Four orange spheres seen traveling east to west at 9:45 in Beloit, WI.",5 minutes,2015-07-31T00:00:00
2015-07-26T21:47:00,MO,Arnold,fireball,"Spotted a bright orange, burning fireball heading northeast.",3 minutes,2015-07-31T00:00:00
2015-07-26T23:30:00,IL,River Grove,triangle,"I was smoking a cigarette through my window, when I spotted very white bright lights hovering in the sky.",2-3 minutes,2015-07-31T00:00:00
2015-07-26T22:20:00,ON,Toronto,light,"One small, one large deep red light fading on and off following one another closely in a circle around the city of Toronto.",5-7 minutes,2015-07-31T00:00:00
2015-07-27T13:00:00,WA,Bellingham,circle,White circle dot w/markings above a black helicopter.  ((NUFORC Note:  Lens flare.  PD)),unknown,2015-07-31T00:00:00
2015-07-27T13:00:00,OR,Redmond,light,"Unusual bright object, visible during mid-day; bright blue sky.",1 hour,2015-07-31T00:00:00
2015-07-27T19:15:00,PA,Berwick,sphere,Larger craft and small sphere using cloud as cover.  ((NUFORC Note:  Photos show tiny speck.  PD)),2 minutes,2015-07-31T00:00:00
2015-07-27T19:35:00,OR,Eagle Point,oval,Metallic oval light over Southern Oregon viewed for several minutes.,2 minutes,2015-07-31T00:00:00
2015-07-27T20:15:00,SD,Sioux Falls,other,I have 4 excellent pictures would like someone to look at them.,3-6 minutes,2015-07-31T00:00:00
2015-07-27T20:50:00,GA,Acworth,oval,My wife and I were sitting on the porch and she saw the obj. in the sky and told me to look at the object that's when it disappeared.,5 minutes,2015-07-31T00:00:00
2000-09-11T00:30:00,IL,Peoria,formation,looked like a three color mercedes cymbol,still there,2000-09-17T00:00:00
2015-07-27T21:12:00,NC,Monroe,cigar,"Vertical, orange, cigar shaped craft.",10 minutes,2015-07-31T00:00:00
2015-08-01T02:05:00,CA,Ventura,unknown,"Object slowly rising, then took off like nothing man made.",30 seconds,2015-08-06T00:00:00
2015-08-01T20:22:00,AZ,Tempe,formation,Formation of about 8 to 10 dim reddish lights.,~4 minutes,2015-08-06T00:00:00
2015-08-01T21:20:00,IL,Marseilles,fireball,Various self piloting fireballs.  Succeeded by red light craft.,2 minutes,2015-08-06T00:00:00
2015-08-01T21:21:00,AZ,Tempe,light,"Ten points of light flying formation in the sky over Tempe, AZ, 21:21 hrs 1 AUG 2015.",10 minutes,2015-08-06T00:00:00
2015-08-01T21:30:00,PA,Langhorne,light,Cluster of 50 orange lights in night sky over Langhorne.,2-4 minutes,2015-08-06T00:00:00
2015-08-01T21:30:00,WI,Oak Creek,sphere,Two red orange fireballs fly low over neighborhood.,10 minutes,2015-08-06T00:00:00
2015-08-01T21:36:00,NY,Lagrange,circle,Witnessed multiple red orb shapes moving in a line from below the hor. to middle sky.  The lights appeared to be blinking or pulsing.,5 minutes,2015-08-06T00:00:00
2015-08-01T21:30:00,IL,Ottawa,light,"Strange fire-like lights in the sky (3 total) near Ottawa, IL, that extinguished after a few minutes, leaving only a red light.",2 minutes,2015-08-06T00:00:00
2015-08-01T22:00:00,MN,Champlin,light,Steady orange lights traveling from SW horizon to NE horizon in under 30 seconds.,30 minutes,2015-08-06T00:00:00
2000-09-11T00:30:00,IL,Peoria,formation,two more showed up!,still there,2000-09-17T00:00:00
2015-08-01T22:00:00,MI,North Central Upper Peninsula,light,"Intensely bright, red-and-white flashing, silent, slowly moving object.",7 minutes,2015-08-06T00:00:00
2015-08-01T22:00:00,WY,Torrington,sphere,One large bright light split into two.,5 minutes,2015-08-06T00:00:00
2015-08-01T22:10:00,LA,Gonzales,light,"Walking after dinner and looking to big moon in clear sky, all of sudden a very fast white light appeared in sky.",40 seconds,2015-08-06T00:00:00
2015-07-27T21:30:00,NC,Durham,cigar,"Driving and saw a cigar shaped object moving slowly, gliding.  Way larger than a plane. Not near the airport. Thought maybe it was a bl",3 minutes,2015-07-31T00:00:00
2015-07-27T22:00:00,IN,San Pierre,circle,Bright flashing yellow light moving fast.,1 minute,2015-07-31T00:00:00
2015-07-27T22:00:00,NY,Diamond Point,triangle,"Three motionless triangular objects, high in evening sky, over Lake George area, having reddish glow on the tips of craft.",10 minutes,2015-07-31T00:00:00
2015-07-28T00:00:00,WA,Olympia,other,Tons of activity in Olympia's sky.,Everyday,2015-07-31T00:00:00
2015-07-28T01:15:00,CA,Antioch,fireball,Fireball over Antioch California seen for 15-20 minutes travelling at varying speeds and making dramatic direction changes.,15 minutes,2015-07-31T00:00:00
2015-07-28T01:30:00,NH,Salem,unknown,A loud humming/whistling object with bright lights flew over my home.,30 seconds,2015-07-31T00:00:00
2015-07-28T12:00:00,IN,Noblesville,unknown,"In Google Earth go to street level 385 Cliff Overlook Noblesville, IN, (46062) or further north on same street.",google earth,2015-07-31T00:00:00
2000-09-12T01:55:00,FL,Jasper,circle,me & my wife have seen it for at least a 3 weeks now it stays in one spot it come & goes ?? sure like to know what it is,,2000-09-17T00:00:00
2015-07-28T18:15:00,WA,Spokane,light,"Father and son witness two highly-reflective, disk-shaped craft, in the southeastern sky of Spokane.",30 minutes,2015-07-31T00:00:00
2015-07-28T22:15:00,WA,Kirkland,light,"Quick color changing, blinking object seen flying in Kirkland.",1 minutes,2015-07-31T00:00:00
2015-07-28T19:57:00,TX,Seabrook,formation,"Witnessed 15 Flame Orbs in Seabrook, Texas.",5 minutes,2015-07-31T00:00:00
2015-08-01T22:15:00,MD,Gamrbrills,light,Large mass of blinking lights that splits into 2 and moves in different directions.,2 minutes,2015-08-06T00:00:00
2015-08-01T22:30:00,NC,Franklin,fireball,"Slow moving fireball, with no sound, in North Carolina.",~30 seconds,2015-08-06T00:00:00
2015-08-01T22:30:00,WV,Barboursville,triangle,"Orange triangular shaped object hovering in the sky over our Beechfork State Park campgound, Barboursville, WV.",15 minutes,2015-08-06T00:00:00
2015-08-01T22:45:00,OH,Powell,cone,Very large orange/red circle with conicle rear; Appeared to have a tail/trail or be on fair at the rear.,1-2 minutes,2015-08-06T00:00:00
2015-08-01T23:00:00,NY,Hicksville,formation,Invasion of numerous bright orange/yellow lights across sky.,7 minutes,2015-08-06T00:00:00
2015-08-01T23:00:00,NY,Mastic Beach,light,"1 Greenish changing to Red light moved slowly at first then swirled around once rapidly only to disappear after 2 min., reappears.",2 minutes,2015-08-06T00:00:00
2015-08-01T23:30:00,PA,Glenmoore,unknown,4 red light in sky over Glenmoore Pa. 8/1/15  at 11:30 PM.,60 seconds,2015-08-06T00:00:00
2000-09-12T07:50:00,WA,Gold Bar,triangle,"Strange ""V"" formation in morning sky over the Skykomish Valley.",10min,2000-09-17T00:00:00
2015-08-02T00:00:00,MO,Lees Summit,triangle,Triangle object seen flying over Lees Summit.,5 minutes,2015-08-06T00:00:00
2015-08-02T00:13:00,TX,Lewisville,circle,"I saw a star like object flickering strangely. I got up and saw it was rapidly flashing red green orange white blue, no real pattern i.",30 minutes,2015-08-06T00:00:00
2015-08-02T01:10:00,NV,Reno,circle,"I saw a bright white light shooting across the sky, which at first I thought was a shooting star. Then milliseconds later I saw an obje",Seconds,2015-08-06T00:00:00
2015-08-02T01:30:00,NV,Reno,unknown,"2 women are frightened by a very loud low flying object, while in their hotel room, watching a lightening storm.",1 minute,2015-08-06T00:00:00
2015-07-29T02:08:00,,Hinckley (UK/England),circle,A bright white circular object moving rapidly across the sky.,5 minutes,2015-07-31T00:00:00
2015-07-29T13:30:00,CA,Chula Vista,disk,Silver disc object over Mexican airspace,2 minutes,2015-07-31T00:00:00
2015-07-29T13:32:00,IA,Waterloo,sphere,Looked like 15-16 spheres which had translucent colors.  Rotated around each each other slowly then disappeared; reappeared.,1 minute,2015-07-31T00:00:00
2015-07-29T20:27:00,CA,Ramona,light,"I heard a pulsating sound, thought, ""That's a weird sounding helicopter.""  Looked up and saw a jet following a light.",1 minute,2015-07-31T00:00:00
2015-07-29T21:00:00,NY,Castleton,triangle,"Triangle shape with bright (red, orange, white).",20,2015-07-31T00:00:00
2015-07-29T21:00:00,RI,Bristol,sphere,Three purple/red objects with strobe traveling SE to ENE.,30 seconds,2015-07-31T00:00:00
2017-04-29T20:10:00,FL,Coconut Creek,light,"Very white, bright circular light, perfectly still.  Approximately 40-50 feet in the air.  Lasted 45 minutes and suddenly vanished.",45 minutes,2017-05-06T00:00:00
2000-09-12T14:30:00,CA,Walnut,sphere,I went out at 2:30 PM in the afternoon. I through out the trush I look it the sky in the Northwest it fly and stop in about three then,10 Mniutes,2000-09-17T00:00:00
2015-07-29T21:48:00,OH,Grove City,sphere,Red pulsing orb moving silently across the sky.,5 minutes,2015-07-31T00:00:00
2015-07-29T22:00:00,CA,Salton City,circle,Bright yellow circle lights.,5 minutes,2015-07-31T00:00:00
2015-07-29T22:00:00,SC,Columbia,disk,"Saucer shape with red, yellow, green lights like lights on a ferris wheel at the stat fair.  ((NUFORC Note:  ""Twinkling"" star?  PD))",2 hours,2015-07-31T00:00:00
2015-07-29T22:30:00,MA,Chelsea,oval,"Bright, oval shape at very high speed zoomed through the sky.  I found a report from Leicester, MA on 6/26 and it was exactly the same.",Seconds,2015-07-31T00:00:00
2015-08-02T02:00:00,NJ,Long Beach Island,unknown,"Unidentified object was sighted over North Beach, LBI.",10 minutes,2015-08-06T00:00:00
2015-07-29T22:45:00,AB,Edmonton,light,"Witnessing three light objects above Edmonton, Alberta, Canada at 10:45 pm July 29, 2015.",2 minutes,2015-07-31T00:00:00
2015-08-02T07:55:00,TN,Jefferson City,cylinder,Tubular silent unknown above flying SE.,Seconds,2015-08-06T00:00:00
2015-08-02T09:45:00,GA,Warner Robins,fireball,"Wife and I saw an glowing orange orb fly overhead, and then disappear to the west.....",50 seconds,2015-08-06T00:00:00
2015-08-02T14:00:00,MA,Boston,unknown,"While at the beach with my family I noticed 4 military helicopter flying low, across Boston.  This is unusual so I took a picture.",3 minutes,2015-08-06T00:00:00
2015-08-02T18:40:00,RI,Warwick,sphere,"Bright reddish/orange self-illuminated sphere rising up from Warwick Pond in Warwick, Rhode Island.",10 seconds,2015-08-06T00:00:00
2000-09-12T19:30:00,TX,San Antonio,other,"This object moved across the sky leaving no smoke trail, vabor trail, no sound or never changed direction, sighted for 20 min.",15 Min.- 20 Min.,2000-09-17T00:00:00
2015-08-02T19:00:00,NV,Las Vegas,sphere,Spheres.,5 minutes,2015-08-06T00:00:00
2015-08-02T20:15:00,MA,Sandwich,fireball,The first sighting was two bright orange/red balls going thru the sky with no sound.,15 minutes,2015-08-06T00:00:00
2015-08-02T22:00:00,LA,New Orleans,circle,Two circular lights shoot across the might sky.,10 minutes,2015-08-06T00:00:00
2015-08-02T22:40:00,OH,Reynoldsburg,sphere,"Sphere, high in sky, west to east.  Very high speed, stopped on a dime, elevated, lowered and continued.",4 minutes,2015-08-06T00:00:00
2015-08-02T23:00:00,MT,Bozeman,sphere,Orange sphere below waning moon south of bozeman,15 minutes,2015-08-06T00:00:00
2015-08-02T23:21:00,VA,Virginia Beach,unknown,"Large, bright blue & red lights over Virginia Beach.",10 minutes,2015-08-06T00:00:00
2015-08-03T00:30:00,WV,Rupert,unknown,UFO with orange light in a hurry to get somewhere.,Seconds,2015-08-06T00:00:00
2015-07-30T00:30:00,NC,Southern Pines,fireball,Very large green fireball moving through the sky.   ((NUFORC Note:  Possible meteor?  PD)),Few seconds,2015-07-31T00:00:00
2015-07-30T01:30:00,MT,Browning,sphere,Bright light rapidly changing direction in the night sky.,1 minute,2015-07-31T00:00:00
2015-07-30T12:15:00,MT,Billings,circle,A reddish circle moving slowly across the sky from the west to the east.  Got smaller and smaller and disappeared.,10 minutes,2015-07-31T00:00:00
2000-09-13T05:55:00,VA,Leesburg,rectangle,Highly illuminated rectangular shaped object tilted at a 20-30 degree angle in the early AM hours.,1 minute,2000-09-17T00:00:00
2015-07-30T03:00:00,MD,Berlin,light,"The a/c was just above the tree line, going at a fast rate.  It was flashing red and white lights.  It was heading north towards Dover.",2 minutes,2015-07-31T00:00:00
2015-07-30T13:30:00,OR,Troutdale,disk,"Long, flat whitish silver object between Clackamas and Troutdale, Oregon.",10 minutes,2015-07-31T00:00:00
2015-07-30T21:00:00,IL,Bloomington,changing,Traveling north on Route 29 outside Bloomington when in the sky was some type of craft that kept changing positions.,30 minutes,2015-07-31T00:00:00
2015-07-30T21:40:00,KY,Louisa,circle,Circle shaped white light moved fast (no streaks of light/no sound) then disappeared.,1-2 seconds,2015-07-31T00:00:00
2015-07-30T21:50:00,NE,Lincoln,light,"Red, green, and yellow flashing lights moving in ninety degree angles.",15 minutes,2015-07-31T00:00:00
2015-07-30T23:00:00,SC,Georgetown,flash,2-3 Bright fireball lights in sky which fade slowly on and off.,5 minutes,2015-07-31T00:00:00
2015-07-30T23:32:00,AR,Fayetteville,triangle,"A hovering triangular craft, 2 red lights (one blinking) and 1 white light.",still there,2015-07-31T00:00:00
2015-07-31T01:30:00,CT,Hartford,disk,"3 lights, blue, green, and white appeared around the location of where they are building the new baseball stadium.",6 seconds,2015-07-31T00:00:00
2015-07-31T01:44:00,VA,Virginia Beach,light,Lights in sky with 3 globe looking lights.,30 minutes,2015-07-31T00:00:00
2015-08-03T02:00:00,OR,Florence,circle,Orange circular object moving fast.,1-2 minutes,2015-08-06T00:00:00
2000-09-13T13:00:00,OH,Toledo,sphere,"sphere, traveling north, 8-10,000 ft, silver white, no sound, changing direction slightly, speed of 180 mph, plane's in the area.",10 min.,2000-09-17T00:00:00
2015-08-03T03:45:00,VA,Richmond,fireball,"Large, silent blue meteor like object fly over James River and quickly disappear.",30 seconds,2015-08-06T00:00:00
2015-08-03T03:59:00,VA,Fairfax,flash,Brilliant flash of light illuminating my entire line of sight for 2 seconds approximately.,2 seconds,2015-08-06T00:00:00
2015-08-03T04:00:00,PA,Cranberry twp,fireball,"Giant green ball of fire fell from sky in 7 Cranberry, PA, last night at 4 am.",10 seconds,2015-08-06T00:00:00
2015-08-03T08:00:00,GA,Atlanta,oval,"I saw a bright dot in the western sky, two attached circles white and silver visible only with binoculars.",10 minutes,2015-08-06T00:00:00
2015-08-03T13:00:00,NV,Las Vegas,formation,"Sitting at pool at Mirage about 8 bright dots in formation they breaking formation. Very very fast motion up down, back and forth.",5-8 minutes,2015-08-06T00:00:00
2015-08-03T13:45:00,MN,Minneapolis,light,Three balls of light seen moving east over industrial area of NE Minneapolis-St. Paul.,2 minutes,2015-08-06T00:00:00
2015-08-03T17:45:00,OK,Tulsa,unknown,"Sun was shining on hovering, still, silver object in western Tulsa sky, about 15 seconds before it vanished.",15 seconds,2015-08-06T00:00:00
2015-08-03T20:00:00,CA,San Diego,oval,Green glowing oval ufo followed by helicopter.,1 minutes,2015-08-06T00:00:00
2015-08-03T21:00:00,NJ,Phillipsburg,triangle,We went out for a drive after eating dinner and came across some triangle aircraft with bright lights hovering above a cemetery.,3 minutes,2015-08-06T00:00:00
2015-08-03T21:00:00,KS,Wilson Lake,light,Amber uniform spaced lights.,1-2 minutes,2015-08-06T00:00:00
2000-09-13T17:00:00,WA,Everett,formation,3 points of light forming a triangle,10 minutes,2000-09-17T00:00:00
2015-07-31T04:20:00,OH,Medina,sphere,"Silent, bright sphere, passes over city of Medina.",6 seconds,2015-07-31T00:00:00
2015-08-03T21:00:00,IL,Jonesboro,fireball,Fireball.,,2015-08-06T00:00:00
2015-08-03T21:30:00,KS,Ellsworth,formation,Witnessed a moving formation of lights in night sky.,1 minutes,2015-08-06T00:00:00
